parent_asin,sentence_id,sentence_text,rating,aspects,sentiments,category_name
B01617VPUY,25770018882,looks like tt will learn the hardway as revenue slips from the loss of 100s of 1000s of xp users deserting them,1.0,[],[],software
B00XJPXIMK,2,i d try a different monitor if i were you,1.0,[],[],electronics_p1
B07KYL58Q1,3,i purchased this to give me more flexibility in connecting other devices and plugs into my system such as sd and sd micro cards an ethernet port which can be used when i am traveling and wifi is not available plus an hdmi port for streaming and presentations,5.0,"[""ethernet port"", ""hdmi port""]","[2, 2]",electronics_p2
B00E3FHXYO,30,maybe i received a single bad device amidst many good [GENERIC_NOUN] but i wo nt take that chance again,1.0,"[""device""]",[0],electronics_p2
B0C371F3VT,1,the only [GENERIC_NOUN] i found better than these cost 5 [GENERIC_NOUN] as much and don t even come with a recharging [GENERIC_NOUN] 50 additional charge,5.0,[],[],electronics_p1
B0797FQ7RX,1,colored parker style refills are not the easiest [GENERIC_NOUN] to find since there is not a large market for it,3.0,"[""colored parker style refills"", ""market""]","[""0"", ""0""]",office_products
B0B6HYZSL6,1,the front padding is nice if you work on the couch a [GENERIC_NOUN],5.0,"[""front padding""]","[""2""]",office_products
B002X77OZM,2,works great but can only run safely for short periods of [GENERIC_NOUN] this [GENERIC_NOUN] works very well but it is also teaching me the art of patience,4.0,[],[],electronics_p1
B00B2TET3C,773320,fun [GENERIC_NOUN] good game the gift bombs are a nice power play,5.0,"[""game"", ""gift bombs""]","[2, 2]",software
B0BFWVLH9W,2,the only [GENERIC_NOUN] i wish they had was a hook to hold onto the paper or book i am writing on,4.0,"[""hook"", ""paper"", ""book""]","[""1"", ""1"", ""1""]",office_products
B01D3BDXQA,4,picture is quality is sharp enough,4.0,"[""picture""]",[2],electronics_p1
B095K9RR32,1,i love that the keyboard is bluetooth and doesn t have to be connected to the tablet,5.0,"[""keyboard""]",[2],electronics_p1
B09DF5NBZB,13,the alexa app on my samsung tablet couldn t read the qr code on the bottom of the device probably because the print wasn t very dark,2.0,"[""alexa app"", ""print""]","[0, 0]",electronics_p1
B0018ZDGAC,5,once i started taking pictures of people [GENERIC_NOUN] in the 35 feet distance i noticed several inches of front focus,4.0,"[""front focus""]",[0],electronics_p2
B0BNNCK5YD,13,trash trash trash absolute trash,1.0,[],[],electronics_p2
B01KGZVXU4,1,this story starts with the e vs creeping in to new orleans undercover of a weather witch and an obfuscation spell on a ship,5.0,[],[],kindle_store
B008422IL0,1,good har drive no [GENERIC_NOUN] so far,4.0,"[""har drive""]",[2],electronics_p1
B0094BB4TW,285829,young users of facebook need to be taught the dangers of talking with strangers,4.0,[],[],software
B00H2GDFZ2,68719532058,great tool for personal use and teaching children easy to use and set budget and spending,5.0,"[""tool"", ""tool"", ""budget"", ""spending""]","[2, 2, 2, 2]",software
B00NUAK25A,17180322867,it wouldnt work for me i couldnt get the game to work,2.0,"[""game"", ""game""]","[0, 0]",software
B00XHXJ8Y6,1,great [GENERIC_NOUN] and great value have to give only a brief [GENERIC_NOUN] here,5.0,"[""value""]",[2],electronics_p2
B009KS4XRO,551966,plus i would like to know how some people get a bingo after only [GENERIC_NOUN] number is called,2.0,[],[],software
B003VUM9XM,94489295450,i needed a new hard drive and motherboard which boosted up the pc to 64 [GENERIC_NOUN] technology,5.0,[],[],software
B08HPSGXT9,1,like i said the earbuds have 5 hours of battery life with 2 extra charges provided by the [GENERIC_NOUN] meaning you will get 15 hours total just not consecutively out of [GENERIC_NOUN] full charge of the [GENERIC_NOUN],5.0,[],[],electronics_p1
B01A8KBCX0,2,three [GENERIC_NOUN] sounds ok wires are a [GENERIC_NOUN] thinner than i anticipated,3.0,"[""sound"", ""wires""]","[1, 0]",electronics_p2
B07Q33SJDW,25770052253,none of their canned support text directions worked,1.0,"[""support text directions""]",[0],software
B00992CF6W,10899,cheat dig build survive,5.0,[],[],software
B01MYHD206,1,[GENERIC_NOUN] defective due to design specs american silver eagles wont fit,1.0,"[""american silver eagles""]","[""0""]",office_products
B00D601UC8,5,br br i just ordered this asin b009h0xqpa dell s2740l 927m9 ips led 27 inch screen led lit monitor instead of the dell 24 so hopefully this will have me fix up,1.0,[],[],electronics_p1
B01K8B8YA8,445,this is our 2nd echo dot,5.0,[],[],electronics_p2
B0070Z8CJO,1,br br had an older 3234 sony lcd xbr and needed to upgrade in size,5.0,[],[],electronics_p2
B07MZN3MLB,2,so i had my hubby sharpen it for me i applied some oil and tada 4 letter opener worth a 10 opener,4.0,[],[],office_products
B0821RJH83,4,people who need a [GENERIC_NOUN] of space or who keep track of passwords for other people for work or just family might not be satisfied with the number of pages but i keep track of my own information as well as my parents and grandparents and it is enough for me,5.0,"[""number of pages""]","[""0""]",office_products
B003XKGIH8,2,not the ribbon pictured not the ribbon pictured,1.0,[],[],office_products
B004KOHJL0,1,five [GENERIC_NOUN] love these,5.0,[],[],office_products
B08HNDGRJ5,29,although it works fine for my desktop 360 and ps3 my snes and gamecube are left in the dark,5.0,[],[],electronics_p2
B08QSB7SR3,24,the night vision is actually really good,4.0,"[""night vision""]",[2],electronics_p2
B083VRNFP9,5,the new paranormal unit at the police department is on some shaky ground though i dont really understand why and rain is being inundated with ghosts,4.0,[],[],kindle_store
B01N78T39B,9,five [GENERIC_NOUN] very good and useful,5.0,[],[],electronics_p2
B0C5364Z2D,2,i purchased these for my classroom to use during calendar [GENERIC_NOUN],5.0,[],[],office_products
B00E57BSMI,1,great little speaker,4.0,"[""speaker""]",[2],electronics_p2
B01J477E4Y,1,awesome price friendly and straight to the [GENERIC_NOUN] love these beautiful white envelopes,5.0,"[""price"", ""envelopes""]","[""2"", ""2""]",office_products
B01CYNCMSS,3,the story had almost zero plot the characters had almost zero depth the writing was amateur at best and lazy about typos and grammar,2.0,"[""story"", ""characters"", ""writing"", ""writing""]","[0, 0, 0, 0]",kindle_store
B01KICHKIE,8590313702,ok service a few programs tried to hold me hostage at the end of the service,3.0,"[""service"", ""programs""]","[1, 0]",software
B07KYQD31V,6,i can not wait to see what the author does with the rest of the series now,5.0,[],[],kindle_store
B07CZMK9HB,4,it charged but the volume control did not work and there was no sound,1.0,"[""volume control"", ""volume control""]","[0, 0]",electronics_p1
B07DLN4LSJ,3,directv apparently is not entirely nonterrestrial,5.0,[],[],electronics_p2
B00FB50SBU,1,great protection for carrying laptop and easy to carry with different straps,5.0,"[""protection""]",[2],electronics_p1
B007ZGO7EM,8590325284,calculator is easy to use,4.0,"[""calculator""]",[2],software
B00YY9UY8G,1,best purchase i ve made on [DOMAIN_NOISE],5.0,[],[],electronics_p2
B00M4I1BAY,15,it has some cool features like a pass through that allows me to bring up tv menus regardless of which device tv roku or apple tv i m controlling,5.0,"[""features"", ""pass through""]","[2, 2]",electronics_p2
B00JICUQZ0,2,the only [GENERIC_NOUN] is waiting until june to find out what happens,5.0,[],[],kindle_store
B009T3EYHO,23,the extra google drive space has come in handy to access all of my files and use the google document spreadsheet and slideshow tools to work on the [GENERIC_NOUN] i need done,5.0,"[""google drive space""]",[2],electronics_p2
B001JT1CEE,1,i m not sure why its so hard to find a spool of red and black woven copper wires stuck together,5.0,[],[],electronics_p2
B00FAPF5U0,79208,ok randomly loses collections of special candies,3.0,"[""collections of special candies""]",[0],software
B07DDBT2XR,1,ipad does not always go into rest when folio is closed,2.0,[],[],electronics_p1
B0011UIX2K,24,in order to hear a call you have to reach for the stereo to turn the volume up at the start of the call then you have to scramble to turn it [GENERIC_NOUN] down again to avoid having your head taken off when the call ends and the music starts again,1.0,[],[],electronics_p1
B00I5VT8KY,797628,i used it to watch nascar while my wife watched a movie,1.0,[],[],software
B007FZOXJM,2,almost every chapter brings new information and twists and turns,5.0,[],[],kindle_store
B08X9HYPZJ,1,great little helper to split your ethernet cable to supply several devices mine included a tivo and a blu ray player br just plug your ethernet cable into any port then plug in ethernet cables from any port br to each device then plug in the power supply included and it all works,5.0,"[""helper""]",[2],electronics_p1
B00C1E2KSS,1,excellent quality great [GENERIC_NOUN] for a tweenie to use to keep his nabi tablet safe and sound without breaking or cracking the screen,5.0,"[""quality""]",[2],electronics_p1
B00U3FPN4U,1,great for streaming tv great for streaming tv,5.0,[],[],electronics_p1
B00006HU4Z,3,my only concern is the adhesive seems to be breaking down,2.0,"[""adhesive""]","[""0""]",office_products
B001CJQGM4,282831,it knows youre going to make a dvd playable by dvd players so it does this step for you,5.0,[],[],software
B08P7TYG41,1,i cant wait to see where the series goes,5.0,[],[],kindle_store
B07C92RFZP,2,find and select the 34machine info34 option on your printers screenbr 3,4.0,[],[],office_products
B01MTMR954,1,decent [GENERIC_NOUN] for good price editso after a couple [GENERIC_NOUN] use about 25 of the magnets have come out of the pins,2.0,"[""magnets"", ""price"", ""magnets""]","[""1"", ""2"", ""0""]",office_products
B08MVRD546,3,motivated by america's bilingual siri and my car now speak to me in french effortlessly building my proficiency,5.0,"[""siri""]",[2],kindle_store
B000FCK6EI,1,the incredible story telling is beyond words,5.0,"[""story telling""]",[2],kindle_store
B07R8L532P,1,five [GENERIC_NOUN] works great 12 miles from tv towers,5.0,[],[],electronics_p1
B0106N82WI,1,this pack was a perfect fit,5.0,"[""pack""]","[""2""]",office_products
B07DPKVYXR,1,good looking but pricey hub,5.0,"[""hub"", ""hub""]","[2, 0]",electronics_p2
B004JK61K0,77309438678,fanastic email [GENERIC_NOUN] the program is marketed as a more functional [DOMAIN_NOISE] for the default mail application included on most phones and tablets,5.0,"[""program"", ""mail application""]","[2, 2]",software
B082B5YT7D,3,[GENERIC_NOUN] work out,5.0,[],[],kindle_store
B00NG7JVSQ,8590222761,the [GENERIC_NOUN] has come for damage control,1.0,[],[],software
B001OC5JKY,2,the actual size is a little larger than the specs described,5.0,"[""size""]",[0],electronics_p1
B00QOPG5MC,3,the 40 inch mounted easily,4.0,[],[],electronics_p1
B009IKCFT2,3,within this power and hz range all headphones i tried have a distortion [GENERIC_NOUN] at the high bass and treble region seems like you are trying to over speed by a 1,5.0,"[""bass and treble region""]",[0],electronics_p2
B001N87MI6,1,great sound awesome price i replaced some commercial jbl bose in ceiling speakers with these and the monoprice actually sound much better,5.0,"[""sound"", ""price"", ""sound""]","[2, 2, 2]",electronics_p2
B004ULYLIM,10,so good plot reasonable character s and at the moment zero cost to own equals a five [GENERIC_NOUN] [GENERIC_NOUN] right,3.0,"[""plot"", ""character""]","[2, 1]",kindle_store
B00Z5PE5J2,2,[GENERIC_NOUN] will tell about durability,5.0,[],[],electronics_p1
B07VC6QMR9,4,i would buy another if the need arose and would certainly recommend this to others,5.0,[],[],office_products
B01KAGYKSQ,1,[DOMAIN_NOISE] was personable and sent a note thanking me for my purchase family owned business,5.0,[],[],office_products
B01AGGG4ZW,4,his search leads him to an englishwoman by the name of miss philomena lockhart,5.0,[],[],kindle_store
B08DNK2759,4,missing iteam the screen protected was not in the [DOMAIN_NOISE] as well,1.0,"[""screen protected""]",[0],electronics_p2
B06ZZHV669,3,john 8 32 it is recorded and ye shall know the truth and the truth shall make you free,5.0,[],[],kindle_store
B00ET0PZDO,60129557275,developer should have tested before releasing,1.0,[],[],software
B07KYH4QBD,4,cecilias chief bully happens to be related to landon,4.0,[],[],kindle_store
B093YDBDPN,2,br overall great quality br recommended,5.0,"[""quality""]",[2],electronics_p1
B071ZTJWM7,25770175166,alexa is also obnoxious constantly responding to any music request by pushing music unlimited,1.0,"[""alexa"", ""music request""]","[0, 0]",software
B091LDVYZK,2,no fit my pc usb i got it because my 16gb phone was having [GENERIC_NOUN] with the file sizes for my new toy,3.0,[],[],electronics_p1
B09BLRMH7R,4,i just keep wanting her to let go and see how wonderful lucy is,5.0,"[""lucy""]",[2],kindle_store
B00PHZKM9M,1,enjoyed the characters,4.0,"[""characters""]",[2],kindle_store
B01LY8FRSO,1,quality is ok its ok on the price we pay for it,5.0,"[""quality"", ""price""]","[""1"", ""1""]",office_products
B07KDKXGRV,5,it allows the reader a better opportunity to get to know the characters better and really follow their ups and downs as they try to figure out the [GENERIC_NOUN] to their hea,5.0,[],[],kindle_store
B007P8BMTS,51539711217,i like a couple of shows on the cw but feel this app did not give you enough choices,2.0,"[""app""]",[0],software
B09RPZPT6C,3,hunter the owner of the local newspaper has become a loner since his military tours,5.0,[],[],kindle_store
B00I6IKSZ0,8590309702,potentially dangerous i love the game but i can [GENERIC_NOUN] of see what some onestar [GENERIC_NOUN] are talking about,4.0,"[""game""]",[2],software
B00PV27618,6,the scenes are easy to visualize with her descriptions and the bedroom elevator and beach scenes are so electric and hot it requires lots of ice water at the least,5.0,"[""scenes"", ""descriptions"", ""scenes"", ""scenes""]","[2, 2, 2, 2]",kindle_store
B0002UBDDG,5,the rx3115 is almost as thin and still fits in my front pants pocket,4.0,[],[],office_products
B01J2G4VBG,2,honestly any usb charger adapter will work fine,5.0,"[""usb charger adapter""]",[2],electronics_p2
B0792K2BK6,60,not good in playing nonenglish songs with voice commands alexa does nt understand nonenglish songs to play from music service such as spotify which google home does nicely,1.0,"[""voice commands"", ""alexa""]","[0, 0]",electronics_p2
B00NG7K2RA,42949716964,as other reviewers stated i too am disappointed that turbotax removed forms from its basic and deluxe versions,1.0,"[""turbotax""]",[0],software
B00P4AVA78,51539834127,some of the chapters are long so i wish the game had a save option,5.0,"[""chapters"", ""game""]","[0, 1]",software
B07QLQKB4H,3,the pages dont bleed through and theres enough space for weekly planning,5.0,"[""pages"", ""space""]","[""2"", ""2""]",office_products
B01GKBHY4M,103079307041,fun game its a fun game,5.0,[],[],software
B00EOLHKSG,1,five [GENERIC_NOUN] my niece loved it,5.0,[],[],office_products
B00TQKAO1K,19,the left bud was slightly louder than the right and the bluetooth signal was nt always reliable,2.0,"[""left bud"", ""bluetooth signal""]","[0, 0]",electronics_p2
B0BGGR6K4M,1,decent [GENERIC_NOUN] so far this cooling pad is working as described,4.0,"[""cooling pad""]",[2],electronics_p1
B00R53HANA,4,i love how some of the meals have crossovers of the same ingredient so that i do not have to purchase too much food i am not breaking the bank for these meals,5.0,"[""meals"", ""meals""]","[2, 2]",kindle_store
B06XSX2DYR,1,i love it and its much cheeper the the apple store if u can make more designs that will be wonderful,5.0,"[""price""]",[2],electronics_p2
B00CL8FA4A,3,works as advertised i bought mine at the local staples store for the same price as listed here,5.0,[],[],electronics_p2
B00L0YLRUW,170,now with this extender i have a strong signal and no dropped wifi service,5.0,"[""signal"", ""wifi service""]","[2, 2]",electronics_p2
B007YLTKNG,1,now starting at the beginning of the career featuring anna travis i found the story line 34 unputdownable34,5.0,"[""story line""]",[2],kindle_store
B01CT5K792,1,alexis abbott did a great job developing the characters,5.0,"[""characters""]",[2],kindle_store
B07DGRVTWF,3,basically a poor implementation of the alexa platform,2.0,"[""alexa platform""]",[0],electronics_p2
B003NR57BY,4,wireless computer mouse works just fine,4.0,"[""wireless computer mouse""]",[2],electronics_p1
B071ZTJWM7,25770173155,my sound systems are capable of excellent sound stage frequency response and dynamic range and amazons hd streaming takes advantage of that,5.0,"[""sound systems"", ""sound systems"", ""amazon's hd streaming""]","[2, 2, 2]",software
B0043EPJN2,2,no downloads get started fast no downloads no hassles just insert a battery hold down the power button until it turns on and you are ready to listen to the bible,5.0,[],[],electronics_p1
B0B7JC1SLW,8,i recorded a video while running prime95 so you can listen for yourself that the fan is near silent even when under a stress test,5.0,"[""fan""]",[2],electronics_p2
B00992CF6W,8948,awesme awesome awesome awesome awesome awesome awesome awesome awesome awesome game,5.0,"[""game"", ""game""]","[2, 2]",software
B00MTEVZFO,5,the sound was adequate played on both my earphones and the projectors builtin speaker,5.0,"[""sound""]",[1],electronics_p2
B001J87JTM,2,booooo who writes and does computations on paper this thin,1.0,[],[],office_products
B01EMQYGWA,8,that and i don t understand why i have to pay about 50 per camera license 34 to unlock the surveillance station s ability to monitor and record more than 2 cameras,5.0,[],[],electronics_p1
B00AIUUXHC,25769806869,great for mature 11yr old and up i think it was a really good game and i enjoyed it personally but for people who are not very mature or are squeamish at the sight of blood you will be grossed out at [GENERIC_NOUN] and you might be a little [GENERIC_NOUN] scared,4.0,"[""game"", ""game"", ""people"", ""people""]","[2, 2, 0, 0]",software
B09188D1LR,1,reid and maddie are adorable together,5.0,"[""reid and maddie""]",[2],kindle_store
B079RSWF2S,6,the remote is small and very portable,5.0,"[""remote""]",[2],electronics_p2
B00AKFBURC,77309538505,a dumb game i dont care for this game as all and would erase it if it wasnt for my grandkids as they love playing it i think because they see what grams has to do and they relate it with me,2.0,"[""game"", ""game"", ""game""]","[0, 0, 2]",software
B07BTL786T,16,need to losen the foam pad in order to charge headphones,4.0,"[""foam pad""]",[0],electronics_p2
B08H417DJ4,51539738682,unable to load the software until windows 7 upgraded to windows 10,3.0,[],[],software
B073QN5JCW,1,awesome little stand,5.0,"[""stand""]",[2],electronics_p2
B09J8ZFZ48,2,average sequential 560mbs read and 530mbs write,5.0,[],[],electronics_p2
B00846GKTW,8589969789,there needs to be better games offered to earn coins,4.0,"[""games""]",[2],software
B01JA8JUVC,1,the lock mechanism that holds the roll of labels likes to pop off,3.0,"[""lock mechanism""]","[""0""]",office_products
B000HLRAJG,94489466179,know that the program can be a wonderful slave and a terrible master,1.0,"[""program"", ""program""]","[2, 0]",software
B005IQGUMI,36,i have a class 10 sdhc memory card in there and it still takes a good couple of seconds for the picture to get processed and for the camera to be ready to take another photo,5.0,"[""picture"", ""camera""]","[0, 0]",electronics_p2
B00992CF6W,19467,good needs some work,4.0,[],[],software
B01MD1DQVG,2,i only gave 4 [GENERIC_NOUN] for the fact the plastic is thinner and lighter then the factory original,4.0,"[""plastic"", ""plastic""]","[0, 0]",electronics_p1
B00HCMG6LG,60129659352,need more levels to keep brain going,4.0,[],[],software
B01MS6QD1O,2,also how to find real love and know it,5.0,[],[],kindle_store
B0CDCBY4DV,4,the laser is very bright i measured its output as 75 mw,2.0,[],[],office_products
B00JG56J2I,103079315817,stupid i thought this game would be really cute by no the app crashes every [GENERIC_NOUN] i try to pick a breed of cat,1.0,"[""game"", ""app""]","[0, 0]",software
B005O2ZU68,3,sorry but until prismacolor gets their act together i won purchase another,1.0,"[""prismacolor""]","[""0""]",office_products
B00KDSGIPK,8590109004,i cant do this with pluto because others are still sleeping and the commercials would bounce them out of bed,3.0,[],[],software
B01DF0TM4Q,3,as an aside and i know this could not be planned my kindle reader features a thermometer across the bottom that tells you how far you have read percentage wise,5.0,[],[],kindle_store
B01G8JO5F2,1,i ve run them dry a couple [GENERIC_NOUN] it gives you [GENERIC_NOUN] warning a few minutes before they die and i can t say it happens easily,5.0,[],[],electronics_p1
B07Y6HNSNL,11,incredible story of acceptance and change love and loyalty with adventure for [GENERIC_NOUN],5.0,"[""story""]",[2],kindle_store
B00009R996,3,i have a 75300 lens in addition to the is lens that comes with it,4.0,[],[],electronics_p2
B00JS2ZCL8,4,when she discovers that her earlier teacher powerful witch taso raym has disappeared and that oraths powers seem to be growing vivia knows that she is in for the battle of her life,5.0,[],[],kindle_store
B001OV7MIC,5,coupled with my new 22inch widescreen lcd monitor this card is just beautiful,5.0,"[""card""]",[2],electronics_p2
B0027CAA7W,2,did nt even need any directions,5.0,"[""directions""]",[2],electronics_p2
B0C4QTJRD3,1,my church supports the children at a local elementary public school where some youngsters families cannot afford school supplies,5.0,[],[],office_products
B07F12VVDJ,4,the sound quality was good overall,3.0,"[""sound quality""]",[2],electronics_p2
B0C2P7CNWG,3,my only [GENERIC_NOUN] is that he cord is [GENERIC_NOUN] too short,5.0,"[""cord""]",[0],electronics_p2
B07BYR66X6,16,good sound for 30,4.0,"[""sound""]",[2],electronics_p2
B091NQVBF3,2,white trim is not dry eraseget the black trim board so this board was instantly ruined when my 5 [GENERIC_NOUN] daughter wrote all along the border trim,1.0,"[""white trim"", ""black trim board"", ""board""]","[""0"", ""0"", ""0""]",office_products
B007WDWO2A,2,works fairly well to stand up horizontally and has an elastic band to keep it closed,5.0,"[""stand up horizontally"", ""elastic band""]","[2, 2]",electronics_p2
B0B8YPGS2Q,2,this little fan is great on my daughters stroller,5.0,"[""fan""]",[2],electronics_p2
B00B1T624C,2,most of the prose read like a journal entry just short descriptions without much emotion or sense of the environment,2.0,"[""prose"", ""descriptions""]","[0, 0]",kindle_store
B07R8KSWP1,1,diamond glam these pens are beautiful with their diamond and write so nice,5.0,"[""pens"", ""pens""]","[""2"", ""2""]",office_products
B014PON9K4,8,as a guy i found that the amount of [GENERIC_NOUN] spent on sally's romance drags on too much overall despite some frustrations i really did enjoy the book and as stated above even bought the 2nd novel a few mins ago which really shows how much i liked the 1st novel,3.0,"[""amount"", ""book"", ""novel""]","[0, 2, 2]",kindle_store
B079C3821T,1,a friend has the s3 and this by far is better save the additional funds my husband loves this watch,5.0,"[""watch"", ""watch""]","[2, 2]",electronics_p2
B095DTFD79,2,does the job arrived on [GENERIC_NOUN] and was exactly what i expected,5.0,[],[],office_products
B01MA2WU55,60129730468,its like a pet my son loves his cozmo robot,5.0,"[""cozmo robot""]",[2],software
B07Q5H76BX,3,bryce ryan doesnt think so,5.0,[],[],kindle_store
B0119R2DB6,8590528754,fun game lots of fun very challenging,5.0,"[""game"", ""game""]","[2, 2]",software
B008I64L4O,1,easy as 123 very easy to file claim and response was quick,5.0,"[""claim"", ""response""]","[2, 2]",electronics_p2
B01MRXG6PI,4,i really like how realistic this story felt,4.0,"[""story""]",[2],kindle_store
B0069G5Z9K,25770143591,surprisingly fun simple yet addicting game,5.0,"[""game"", ""game"", ""game""]","[2, 2, 2]",software
B001LXUZPK,2,cheap plastic with a flimsy arm holding the microphone,1.0,"[""plastic"", ""arm""]","[0, 0]",electronics_p2
B0B4FXQ84N,1,only good for light use my [GENERIC_NOUN] came with dents already,3.0,[],[],electronics_p2
B0B4KJRD1C,2,this mouse is fantastic,5.0,"[""mouse""]",[2],electronics_p1
B00007JO8C,2,so for the first impact it did its job,3.0,[],[],electronics_p2
B078G91T8X,1,good [GENERIC_NOUN] works great for me at my work in a noisy warehouse,5.0,[],[],electronics_p1
B07MCT1GC3,2,great suspense well written and intense,5.0,"[""suspense"", ""writing"", ""story""]","[2, 2, 2]",kindle_store
B094GQ2R41,7,my comments are an independent and honest [GENERIC_NOUN],4.0,[],[],kindle_store
B0788PN3VS,4,the remote that came with our smart tv did nt have the buttons for actually resetting andor using the smart tv applications,5.0,"[""remote""]",[0],electronics_p2
B0161YR560,1,on the positive [GENERIC_NOUN] another new feature of the x e2 is improved power management,5.0,"[""power management""]",[2],electronics_p1
B083J8K66K,1,i refuse to believe i cant get this tool to cut so will look for some online demos,1.0,[],[],office_products
B016XD4WRE,1,34 men are not stolen,5.0,[],[],kindle_store
B08PV57QCH,1,the friendlywrt along with docker makes this an ideal platform for tinkering with open source solutions,5.0,"[""platform""]",[2],electronics_p2
B01GYPQRYM,30,its only a dream scarcely applies to what a dragon can do to [GENERIC_NOUN] sleeping mind,5.0,[],[],kindle_store
B013KWKSYM,17180222009,three [GENERIC_NOUN] thank you all some needs to keep it up,3.0,[],[],software
