parent_asin,sentence_id,sentence_text,rating,aspects,sentiments,category_name
B08FBLJTJM,6,the slim barrel forces me to move my grip up further which actually increases my writing speed so im enjoying this pen,4.0,"[""barrel"", ""writing speed"", ""pen""]","[""2"", ""2"", ""2""]",office_products
B00BW08XRO,8590216643,fun game for young kids fun to play easy for kids to figure out,4.0,"[""game"", ""game"", ""game""]","[2, 2, 2]",software
B004JKB83K,42949762250,word mix i wanted every word crossing but they dont have it available for the kindle fire,3.0,"[""word mix"", ""word mix"", ""kindle fire""]","[2, 2, 0]",software
B08HZD3K7J,1,my heart almost stopped at well lets not spoil the story,5.0,[],[],kindle_store
B00E7X8YK4,42949997649,however being forced to upgrade by the threat of removing that addiction is just plain old blackmail,1.0,[],[],software
B01FLD4MHC,34360013719,support was a great help and again i want to thank them for all their help,5.0,"[""support""]",[2],software
B0C3SHRQ91,1,loved the ending,5.0,"[""ending""]",[2],kindle_store
B000V5K3FG,4,five [GENERIC_NOUN] i do youtube videos and this lense is perfect works good you can check us at,5.0,"[""lens"", ""lens""]","[2, 2]",electronics_p2
B008XG1X18,450716,did the update like 20 [GENERIC_NOUN],4.0,[],[],software
B00LMKWMCG,2,the stories are based on a cat named oliver his best friend who is a kangaroo and other animals he meets along the [GENERIC_NOUN],5.0,[],[],kindle_store
B007TAPK2W,103079370549,the pictures are pretty though,1.0,"[""pictures""]",[2],software
B0002IWC9C,1,the batteries i charged held a good charge for what seemed like a long [GENERIC_NOUN],5.0,"[""batteries""]",[2],electronics_p1
B00KIVAX1C,1,an awesome read that is also well constructed,5.0,"[""read"", ""read""]","[2, 2]",kindle_store
B01NAMFKJL,24,its a small [GENERIC_NOUN] and otherwise really i love this kingdel,4.0,"[""kingdel""]",[2],electronics_p2
B07JL4VDSS,85899391349,its ok i love old chinese karate movies but they should have remastered these so the pictures would be better,4.0,"[""old chinese karate movies"", ""old chinese karate movies"", ""pictures""]","[2, 0, 2]",software
B00GAQ3W1M,34359915987,hours of enjoyment to be had you can customize your game tiles change the music and the background,5.0,[],[],software
B01MZ8EZY9,1,i erased a [GENERIC_NOUN] with just water and had a slight shadow used dry erase board cleaner and it came off instantly,5.0,[],[],office_products
B08XNCHTCY,2,i was tired of having wires getting in the [GENERIC_NOUN] and having to carry a punch for my phone that i could access quick,5.0,[],[],electronics_p1
B006ID6NRC,1,love love loved it,5.0,[],[],kindle_store
B0127HPQ48,5,sometimes the switch from [GENERIC_NOUN] scene to the next is a [GENERIC_NOUN] abrupt,4.0,"[""switch""]",[0],kindle_store
B08CV2WGKX,11,stassia is 18 when their relationship starts though,4.0,[],[],kindle_store
B0C337TNGS,6,the [DOMAIN_NOISE] period is thirty [GENERIC_NOUN] now so i can t [DOMAIN_NOISE] them and am dealing with beats on their warranty,1.0,[],[],electronics_p1
B01954PYG6,12,great buy,5.0,[],[],electronics_p2
B0754M923T,1,i like the [GENERIC_NOUN] rick looks at,5.0,[],[],kindle_store
B0872KXGMG,1,our audience gave us feedback that our sound levels were better more consistent and balanced between the two of us,5.0,"[""sound levels"", ""sound levels"", ""sound levels""]","[2, 2, 2]",electronics_p1
B007O3FWM2,103079282753,very easy to look up and post daily foods,5.0,[],[],software
B004FRX0MY,578811,the ability to make my own playlists is great too because i listen to many different [GENERIC_NOUN] of music as does my boyfriend,4.0,"[""ability to make my own playlists""]",[2],software
B00IDHDUIQ,1,no [GENERIC_NOUN] works well would recommend,4.0,[],[],office_products
B07H1KQ3SH,33,easy setup i recently purchased the thin hdtv antennas to cut the cord on [GENERIC_NOUN] of my tvs,5.0,"[""setup""]",[2],electronics_p2
B005HTP7MK,4,i ended up putting a little lube on the ring to let it slide easier and i did get it to work but the inner ring has a [GENERIC_NOUN] of play between it and the new mount,3.0,"[""inner ring""]",[0],electronics_p2
B0BHL5XR6Q,5,br br i actually want two different tablet standsbr home stand remains set up at home without frequent adjustments so its not important for it to be the smallest lightest or easiest to adjust,5.0,[],[],electronics_p2
B00OKYQZDI,34359970260,game is fun for any age,5.0,"[""game""]",[2],software
B07C7D1XVK,1,works as expected works great with my monitor and laptop,5.0,[],[],electronics_p1
B005N2CS8M,34359870573,it is accessible and easy to use however its limitations are that it is only for the existing records in major categories,4.0,"[""it"", ""it"", ""it""]","[2, 2, 0]",software
B017BLMEJK,25770024042,surprisingly fun game plays better than i thought,4.0,"[""game"", ""game""]","[2, 2]",software
B0079T2KHG,9,this unit moves an impressive amount of air for its size and has made quite a difference in her comfort level while she is playing,4.0,[],[],electronics_p1
B0027SFPIA,5,doesn t work no [GENERIC_NOUN] what [GENERIC_NOUN] of scratches you have,1.0,[],[],electronics_p1
B00RN08584,3,the [GENERIC_NOUN] where the buttons are is loose not sure if its supposed to be like that but it doesnt interfere with [GENERIC_NOUN],4.0,[],[],office_products
B005Q3142E,5,because for the arm strap when you are doing some weight lifting or workout on your arm and as your muscle flex i do nt really like the feeling of the arm strap around the biceps area but this is just a personal preference anyway,5.0,"[""arm strap""]",[0],electronics_p2
B0027WICJU,2,as our search for a solution continued we were pleased to discover a true value in asinb0027wicjc hp 96 black hp 97 tricolor remanufactured ink cartridges provided by o c [GENERIC_NOUN] inc,5.0,"[""ink cartridges""]","[""2""]",office_products
B005OMXB8W,1,good buy this was a hard [GENERIC_NOUN] to replace but this is an exact fit,5.0,"[""fit""]",[2],electronics_p2
B00IKZOWB0,19,for those who like steampunk this story does a great job of incorporating victorian steam fashioned machines and current steampunk fetish,4.0,"[""story"", ""machines"", ""steampunk fetish""]","[2, 2, 2]",kindle_store
B00S8TMMFQ,1,mix myths and paranormal,4.0,[],[],kindle_store
B08SW3X4FD,21,great price,5.0,"[""price""]",[2],electronics_p2
B00XTH0WL8,6,great sound,5.0,"[""sound""]",[2],electronics_p2
B01M4NU4OM,46,kidfriendly indeed awesome device great for the kids and full of appropriate content,5.0,"[""device"", ""device"", ""content""]","[2, 2, 2]",electronics_p2
B0C87Y22S8,1,good headphones great so far,5.0,"[""headphones"", ""headphones""]","[2, 2]",electronics_p2
B007CGULSQ,22,updatebr while setting up the printer to work wirelessly i was constantly getting the error that the printer could not be detected on my network,4.0,"[""printer""]","[""0""]",office_products
B018FY9JN6,34359910283,kiptrot enjoy the challenges,4.0,"[""kiptrot""]",[2],software
B00COHALXI,3,we tried several different folders and binders but this binder is worth the price,5.0,"[""binder""]","[""2""]",office_products
B00R1MXPFW,1,has the automatic focus,5.0,[],[],electronics_p1
B00DBF3PA8,3,the world building is great and the story engrossing,5.0,"[""world building"", ""story""]","[2, 2]",kindle_store
B095XXWD5P,3,in the past i wasnt printing very often and my ink was drying up,5.0,[],[],office_products
B00X6TMX8E,1,good quality weight and gold leaf is evenly applied good quality weight and gold leaf is evenly applied,5.0,"[""quality"", ""weight"", ""gold leaf""]","[""2"", ""2"", ""2""]",office_products
B000PS6QY6,68719617896,while the new music track generator works well i have a number of smartsound cds that i can no longer use,5.0,"[""music track generator"", ""smartsound cds""]","[2, 0]",software
B004MNUQAU,42950016832,five [GENERIC_NOUN] un able to play game when the app was accidentally deleted,5.0,[],[],software
B083TH1B45,7,easy to install strong mount,4.0,"[""install"", ""mount""]","[2, 2]",electronics_p2
B09V4QP2GB,2,cute and functional this camera is not only cute but it is functional,5.0,"[""camera"", ""camera""]","[2, 2]",electronics_p2
B00H09BB16,42949919348,five [GENERIC_NOUN] win7 64 is the best os microsoft has come out with to date,5.0,"[""win7 64""]",[2],software
B005PB2SZY,5,i ve had a phone slide off my thigh when i rested it there but there doesn t seem to be any tendency for the kindle to do that,5.0,[],[],electronics_p1
B005GF1QAW,15,this turned them from typical regency characters into real people and made the book much more enjoyable,5.0,"[""regency characters"", ""book""]","[2, 2]",kindle_store
B07CZW3DRZ,11,bottom line is if you re ok with the gps throwing a random route at you then you will like it,2.0,"[""gps""]",[0],electronics_p2
B018AAL1PY,19,not compatible with all apps,4.0,"[""compatibility""]",[0],electronics_p2
B00B10GAU2,3,from stanley the forceful beast of a man to the fragile mind of blanche du bois,5.0,[],[],kindle_store
B01MU8XWHN,42949817022,cookie jam blast cookie jam blast is awesome i really like it,5.0,"[""cookie jam blast"", ""cookie jam blast""]","[2, 2]",software
B07KBWN8L1,1,delay on record my only complaint is the long wait between pressing the record button and the unit starting to record,4.0,"[""record button""]",[0],electronics_p1
B07D449FQD,1,i had purchased a binder that held 500 pages and took apart the 3 preschool workbooks i purchased and the documents the previous teacher left and placed them in the sheet protectors,5.0,[],[],office_products
B0001MHYK6,4,they supposedly have bigger ear cups which will hopefully translate to more comfort,4.0,[],[],electronics_p1
B01GN2IKV4,2,it has all [GENERIC_NOUN] of storage compartments too which is a bonus for me,5.0,"[""storage compartments""]",[2],electronics_p1
B019XEQ6HY,5,i received this [GENERIC_NOUN] at a discounted price for my honest [GENERIC_NOUN],4.0,[],[],electronics_p2
B08L9K7PPW,2,i am using it with a big gtx980 ti ftw and the brace holds it up well,3.0,"[""brace""]",[2],electronics_p2
B008N6XUEQ,13,cops will be sitting literally to the [GENERIC_NOUN] where i can identify the driver of the police car and then the detector will decide to go off and other [GENERIC_NOUN] it will give me around 14 to 12 mile warning,1.0,[],[],electronics_p2
B00JNQMKSC,1,green embers' recommended,4.0,[],[],kindle_store
B0BTVBRKHS,3,additionally they include soft ear plugs which when combined with the mask do an excellent job of blocking out noise,5.0,"[""ear plugs"", ""ear plugs""]","[2, 2]",electronics_p2
B00XZCYHRW,1,i think this is great for people who need to learn to use common sense,3.0,[],[],kindle_store
B08N8GCHGJ,1,it s great as long as its limitations won t affect you read below [GENERIC_NOUN] [GENERIC_NOUN] you should note is that this doesn t just give you ports to plug your devices into it provides actual cables that are hard wired into the switch and thus can t be swapped out,3.0,"[""cables""]",[0],electronics_p1
B08WNGB612,4,stanley his creator is emotionally stunted but learns to love and empathize thanks to dan,5.0,[],[],kindle_store
B0176M3PXI,3,giant masses of spiders quickly overwhelming people isnt as visceral and horrifying at least to me as a close encounter with [GENERIC_NOUN] or a few when were talking books rather than movies,4.0,[],[],kindle_store
B07943SXKJ,1,great [GENERIC_NOUN] great quality,5.0,[],[],office_products
B000R4HRGO,2,i had an idea of how much the [DOMAIN_NOISE] will be weighting but,2.0,[],[],office_products
B001F5A90K,10,the calculators random function is almost useless as it is only three digits i would expect at least 10,5.0,"[""calculators random function"", ""calculators random function""]","[""0"", ""0""]",office_products
B00MEUR1XI,8590445292,easy to get started for newbies as a newcomer to business and keeping the books i have found intuit quickbooks online easy to use and set up,5.0,"[""quickbooks online"", ""quickbooks online""]","[2, 2]",software
B007525JNO,2,second the only music that sounds good on them is 50 cent,2.0,"[""music""]",[2],electronics_p1
B0739V781Z,8590427971,good choices to try,5.0,[],[],software
B0BCXGZ91N,5,what is still so impressive is how many directions this series can go,5.0,[],[],kindle_store
B00004YZQ8,26,br br moreover with the ew63 lens hood flare is not a [GENERIC_NOUN],5.0,"[""flare""]",[2],electronics_p2
B00YCC5SAE,1,1 br samsung pro gray 90 80 10 3,4.0,[],[],electronics_p1
B00IO7JXWW,1,a well written synopsis of two [GENERIC_NOUN] in country serving a well written synopsis of two [GENERIC_NOUN] in country serving as construction engineer then as an aviator by a west pointer,4.0,[],[],kindle_store
B00TWC3RX4,9,stuart is a gentleman who needs to marry money,5.0,[],[],kindle_store
B096VJPKHS,1,was easy to hang and the print is good quality,5.0,"[""print""]","[""2""]",office_products
B0776RDMY8,2,carriger tried to play with various questions of gender and questioning of one's gender identity through prim's own crises but again it was forced,3.0,"[""questions of gender""]",[0],kindle_store
B01DU0R7A2,7,her mom is in the process of selling some of her land since she is unable to take care of it who does she sell it to none other than wyatt and rose is left to face the man she broke his heart but wyatt hurt her too so she thought,5.0,[],[],kindle_store
B00AAJQWTY,4,its up to the avengers to keep the world from falling apart and find those responsible,3.0,[],[],kindle_store
B083XTKV8V,9,also to note the power adapter cable is also on the short [GENERIC_NOUN],5.0,[],[],electronics_p1
B0006J32C8,2,sharp calculator think the calculator will eventually work when i have directions,3.0,[],[],office_products
B07BF61B8W,1,dear [DOMAIN_NOISE] valued customerbr at parkoo shop we truly care about your customer [GENERIC_NOUN] and just importantly your [GENERIC_NOUN] [GENERIC_NOUN],1.0,[],[],office_products
B075JJY2Z8,1,this book reminds me more of her earlier work with a [GENERIC_NOUN] more bdsm scenes but [GENERIC_NOUN] harsh or over the top,5.0,"[""book"", ""scenes"", ""scenes""]","[2, 2, 2]",kindle_store
B093QM12XJ,4,either [GENERIC_NOUN] with the correct divers installed my computer was not able to detect the dock,1.0,"[""dock""]",[0],electronics_p2
B00B928VUE,6,also reading this book more than once is a must,5.0,[],[],kindle_store
B08TLYK78K,4,br i have pretty severe carpel tunnel in my right wrist and arthritis in my hand and my hand is fine at the end of the [GENERIC_NOUN] unlike the unbearable pain caused by using a mouse that you have to move on a mouse pad,5.0,[],[],electronics_p1
B09MK26W7Q,4,br this process was so easy on the soundcore flare its a major disappointment that its become such a complicated and nebulous process with this new generation of speaker,1.0,"[""process"", ""process""]","[0, 0]",electronics_p2
B0030F2U9G,11,the cable has embedded software and it may or may not be the same software that is advertised,1.0,"[""software""]",[0],electronics_p2
B08RY6CMWZ,2,frank actually grows as a person,4.0,[],[],kindle_store
B0064I7INO,2,i can t make that judgement but the sigma really shines and is fully compatible with my nikon d3100,5.0,"[""sigma"", ""sigma""]","[2, 2]",electronics_p1
B0C3QY9DFQ,2,loved this so much that i bought a second set this [GENERIC_NOUN] is perfect for [GENERIC_NOUN] that needs organization for their room or shelves,5.0,"[""set""]","[""2""]",office_products
B07H936BZT,32,i highly recommend this tablet,5.0,"[""tablet""]",[2],electronics_p2
B00F5VTYCO,2,four [GENERIC_NOUN] works fine,4.0,[],[],electronics_p1
B09KP66Z72,1,i have never uploaded pictures on [DOMAIN_NOISE] so that lets you know just how much i love this desk and how it makes my office look,5.0,"[""desk"", ""desk""]","[""2"", ""2""]",office_products
B01JRXN0Q6,1,five [GENERIC_NOUN] clean phone works great,5.0,[],[],electronics_p2
B09QM5TNLL,1,working like a charm so far this switch is definitely an improvement from my last switch,5.0,"[""switch""]",[2],electronics_p2
B0018O9JIG,4,some folks do not like its [DOMAIN_NOISE] and newer [GENERIC_NOUN] because the software installs a bunch of [GENERIC_NOUN] without asking according to what i have read in other [GENERIC_NOUN],5.0,[],[],electronics_p1
B07M7FTXM2,2,i m waiting for new deliver that i was wrong but lucky,4.0,[],[],electronics_p2
B083JPNRXB,1,i love reading these stories about magical gangs waging war with others and the [GENERIC_NOUN] of magical individuals who fight against them,5.0,"[""stories""]",[2],kindle_store
B00CMY4Q2K,1,five [GENERIC_NOUN] perfect,5.0,[],[],office_products
B08SCD82DF,1,the height is nice with plenty of room below to store notebooks,5.0,"[""height""]",[2],electronics_p1
B0811JZDQN,9,so happy with this purchase highly recommend,5.0,[],[],electronics_p2
B0BHBYC695,1,devon and gingers love story is so different,5.0,"[""devon and gingers love story""]",[2],kindle_store
B0C6Q9RKNJ,3,good ballpoint the quality of the pen is very good especially the pen head roller,5.0,"[""ballpoint"", ""quality"", ""pen head roller""]","[""2"", ""2"", ""2""]",office_products
B083NNV9MV,1,seat goes up and down easy enough,5.0,"[""seat""]","[""2""]",office_products
B07W4XJJKL,1,durable fits quite a few pages like the looks stored my daughters school work,5.0,[],[],office_products
B07YH2X9WG,60129741196,price is gouging,2.0,"[""price""]",[0],software
B07WFYYX3J,8,using same cables setup getting 2k 4k respectively with 2 port aimos kvm,1.0,[],[],electronics_p1
B072KLXG5M,3,the sound quality is great,5.0,"[""sound quality""]",[2],electronics_p2
B00V6SL8B0,1,the first 6 [GENERIC_NOUN] was ok water got in to 2 for them the company would nt stand good for them pictures were grate battery life is good value is bad,1.0,"[""company"", ""pictures"", ""battery life"", ""value""]","[0, 2, 2, 0]",electronics_p2
B01M6U3HI4,4,i love how becca allows grady the [GENERIC_NOUN] to terms with his feelings about having a child,4.0,[],[],kindle_store
B0C8TT9JDP,22,they are extremely good or watching movies and video games as they have fairly large sound stage and sound great,4.0,"[""sound stage"", ""sound""]","[2, 2]",electronics_p2
B01DXXKUTG,4,the paper strands also get caught up and cause jams i frequently need to pull paper out of the shredder,3.0,"[""paper strands"", ""paper""]","[""0"", ""0""]",office_products
B0B8PH3177,6,0 ports and even then it is extremely slow,2.0,"[""ports""]",[0],electronics_p1
B014WOX48O,42949816778,if i have any more quotraidsquot that inhibit my progress this game will be uninstalled,1.0,"[""game""]",[0],software
B0081JPTXK,699787,also each new game you play will ask to use memory so the gaming will be enhanced,3.0,[],[],software
B01BGTYZU4,1,g this character's kept me turning the page could,5.0,[],[],kindle_store
B01N6VQQX4,2,[GENERIC_NOUN] [GENERIC_NOUN] im not too fond of is that its not very easy to go straight to the page you need there is a notes section [GENERIC_NOUN] of covering the tab for each [GENERIC_NOUN] but its not a big [GENERIC_NOUN] if you just add your own tabsbookmarks,5.0,"[""page"", ""notes section"", ""tabsbookmarks""]","[""0"", ""1"", ""2""]",office_products
B0013FDLM0,29,a pcmcia or expresscard modem might not be compatible with older or newer laptops and is no more convenient to plug in and use,5.0,"[""modem"", ""modem""]","[0, 0]",electronics_p1
B00E1CRC86,8,this is a good alternative to using the oncamera timer,4.0,[],[],electronics_p2
B09ZKMWCGD,2,perfect monthly calendar i love that its [GENERIC_NOUN] only no weekly,5.0,"[""monthly calendar"", ""weekly""]","[""2"", ""1""]",office_products
B09VPFY569,1,did nt work for me i plug it in install all the drivers the company tells me the windows 10 driver is the same as windows 11 i get a driver error that i ca nt fix for it complete waste of money for me cheap garbage,1.0,"[""functionality"", ""driver"", ""value"", ""quality""]","[0, 0, 0, 0]",electronics_p2
B00KDSGIPK,8590115196,if you were watching mainstream tvnot cable you would have ads so whats the big deal,5.0,[],[],software
B004MFQ2I8,3,great purchase very sturdy,5.0,[],[],electronics_p1
B07T9KV88Z,13,i love this little printer this is a fantastic little printer,5.0,"[""printer"", ""printer""]","[2, 2]",electronics_p2
1441325867,1,it quite flat which means its not hardbon my book bindings,5.0,"[""book bindings""]","[""0""]",office_products
B00H09BB16,42949921016,install was easy enough,5.0,[],[],software
B09NXCKWQN,1,colors are super vibrant and they can withstand abuse,5.0,"[""colors"", ""colors""]","[""2"", ""2""]",office_products
B00NAFEGVG,1,two sided mounting tape works very well,5.0,"[""two sided mounting tape""]","[""2""]",office_products
B01MTGBKPQ,1,great to have error codes,5.0,[],[],electronics_p1
B0BTMQ8VX6,1,worked well contents were easily identifiable,5.0,"[""contents""]","[""2""]",office_products
B0B9T83FRY,1,the fortune keeper is a beautifully atmospheric novel of 17th century venice delivering all the anticipated mystery intrigue danger and love within the shadowed passages and moonlit canals wed expect,5.0,"[""fortune keeper"", ""novel""]","[2, 2]",kindle_store
B00NKBEGDS,3,what is worse is that they have to pose as a live in couple on the competition circuit,5.0,[],[],kindle_store
B013LKLK2M,1,extended my network quick and easy,5.0,[],[],electronics_p1
B074XS5XJT,5,they even took close ups of the dash cam so maybe sales will pick up,4.0,[],[],electronics_p1
B07GLLVX7V,1,i can not wait to read the others in the series to see what happens with ruadan and arianna,5.0,[],[],kindle_store
B09YL2D2RQ,1,excellent elegant simple controls and good output with a properly matched antenna just the radio for the beginner and for the expert to have on hand when the zombies come,5.0,"[""radio"", ""radio"", ""controls"", ""output""]","[2, 2, 2, 2]",electronics_p2
B00E965AUQ,1,great cable this feels like a high quality cable,5.0,"[""cable"", ""cable""]","[2, 2]",electronics_p1
B00OQVZDJM,2,our older [GENERIC_NOUN] died so we upgraded,4.0,[],[],electronics_p1
B09G3MBH6V,3,setup was a [GENERIC_NOUN] of cake and [GENERIC_NOUN] were immediate,5.0,[],[],electronics_p1
B0192911RA,37,just the same old crap,4.0,[],[],electronics_p2
B07J33PQNX,1,meet cyborgs and ai's who is humanity may be called into question,5.0,[],[],kindle_store
B0041O5X8A,4,br br update aug 2015 garmins customer service is outstanding and provided a refurbished [DOMAIN_NOISE] for a price substantially lower than buying a new garmin,4.0,"[""customer service"", ""price""]","[2, 2]",electronics_p2
B0927P3QF2,7,although dale and daisy's relationship is built on daisy's lies they find themselves intensely attracted to each other,5.0,[],[],kindle_store
B0093JKBYO,1,it s an awesome remote and i d say you cannot buy better for the money,4.0,"[""remote""]",[2],electronics_p1
B07T3S1TCG,1,the voice level was ok but for mane different people i called [GENERIC_NOUN] was hearing their own sound two [GENERIC_NOUN],1.0,"[""voice level""]",[1],electronics_p1
B07D1C34G6,2,the ability to edit through the app is very useful,4.0,"[""ability""]","[""2""]",office_products
B005FVDTA2,8,these also have a huge soundstage,4.0,"[""soundstage""]",[2],electronics_p2
B00CC5OYV2,2,guess what this [GENERIC_NOUN] is not eligible for [DOMAIN_NOISE],2.0,[],[],office_products
B01KGZVUHU,1,pipe dreams has many of the elements i love in a book,4.0,"[""pipe dreams""]",[2],kindle_store
B018KGK3XO,3,this was the best laptop money could buy in 2016,5.0,"[""laptop""]",[2],electronics_p2
B00D2JS2K6,2,all my [GENERIC_NOUN] was in south central alaska which is in many ways less challenging then the flying in south west alaska described here but the weather can still bite you,5.0,[],[],kindle_store
B000F7V2GO,5,this is the best solution and installing it requires only a screwdriver and takes less than 5 minutes,5.0,"[""solution"", ""installation""]","[2, 2]",electronics_p2
B09JW6GY4L,1,wireless charging works on my qi charger no [GENERIC_NOUN],5.0,[],[],electronics_p1
B00GEEB6M2,2,romance and some pretty good suspense follow all in all a very satisfying tale,4.0,"[""romance"", ""suspense"", ""tale""]","[2, 2, 2]",kindle_store
B003G4W49C,1,it is ok of a book the encounter should have been facts to face ended and the queen to see what would happen,2.0,[],[],kindle_store
B06XGQRMKR,15,the opinions are mine alone and are not biased in any [GENERIC_NOUN],4.0,[],[],kindle_store
B003UYUOZ4,7,2 in the post script the author added brief explanations of a couple basic plot points,4.0,[],[],kindle_store
B08D1BWLL7,1,great buy all the [GENERIC_NOUN] around love this phone,5.0,"[""phone""]","[""2""]",office_products
B009RVUYAY,1,these cards write much faster in my dslr camera,5.0,"[""cards""]",[2],electronics_p1
B01NGU09BM,3,i really think the 34 questions and thoughts34 for children at the end of the book are a great tool for starting conversations with a child or a group of children,5.0,"[""questions and thoughts""]",[2],kindle_store
B000GD8WKG,17180207306,remember the old [GENERIC_NOUN] of graphing linear equations by calculating the slope and plotting points,5.0,[],[],software
B01N6DC2ZE,6,br br update 11 4 2017 br br so anker contacted me after i posted the original [GENERIC_NOUN] and offered to send a new set of headphones at no cost to me since they were still under warranty,5.0,[],[],electronics_p1
B00J5VC8C8,1,five [GENERIC_NOUN] they are perfect for the cards that i hand make,5.0,"[""cards""]","[""2""]",office_products
B09MLPPZFD,1,the ink is better the roller ball is much smoother to write with and the colors are better,5.0,"[""ink"", ""roller ball"", ""colors""]","[""2"", ""2"", ""2""]",office_products
B075SRPWZT,3,the next [GENERIC_NOUN] is the price of the [GENERIC_NOUN] of training before the mc leaves for the tournament,3.0,[],[],kindle_store
B072FHJVT2,2,great [GENERIC_NOUN],5.0,[],[],electronics_p2
B08WLBCF8X,1,excellent start to what could be a great series,5.0,"[""start"", ""series""]","[2, 2]",kindle_store
