parent_asin,sentence_id,sentence_text,rating,aspects,sentiments,category_name
B01MA4YVNP,1,i took it to three different wall outlets and it sparked at all three when plugging it in,1.0,"[""device""]",[0],electronics_p2
B0015BQ79Q,3,i put in dark knight on blu ray and any of my worries about this tv melted away the picture is absolutely amazing colors are bright blacks are true,5.0,"[""picture"", ""colors"", ""blacks""]","[2, 2, 2]",electronics_p2
B082VSBN2R,4,the sound is amazing and connected to my phone very smooth,1.0,"[""sound"", ""connection to my phone""]","[2, 2]",electronics_p2
B00VANT7IW,6,if the author would have made her a little older it would make it more believable,5.0,"[""character""]",[0],kindle_store
B0BYRDPWT1,1,the chalk pen works well and washes off easily with a damp rag,5.0,"[""chalk pen"", ""chalk pen""]","[""2"", ""2""]",office_products
B000FC2L28,2,gabaldon's command of our language is commendable paints vivid scenes and true emotions,5.0,"[""gabaldon's command"", ""scenes"", ""emotions""]","[2, 2, 2]",kindle_store
B07XF2P9KR,25770162222,got tired of ridiculous cable bills and cut the cord,5.0,[],[],software
B07FG7SBS9,1,five [GENERIC_NOUN] great price fans are quit no noise from them,5.0,"[""fans""]",[2],electronics_p1
B07XD4797M,622177,relaxing game to play,5.0,[],[],software
B07BLNP4SB,1,stands are a combination of lite gauge steel and injection molded plastic,5.0,[],[],electronics_p1
B0B1PYNH8X,1,for echo show 5 i have the 2nd generation echo show 5,5.0,[],[],electronics_p2
B073BLF22X,3,replaced it with all the other blue ink cartriges and some worked others only provided a couple of pages,1.0,"[""blue ink cartridges"", ""blue ink cartridges""]","[""2"", ""0""]",office_products
B01LDA9KJC,2,even better that my kindle copy was free,5.0,"[""kindle copy""]",[2],kindle_store
B09ZLQ7KDV,1,did not even rate but was made to the submit the [GENERIC_NOUN] very disappointed did not receive the [GENERIC_NOUN] that was advertised in the picture,1.0,"[""picture"", ""picture""]","[""0"", ""0""]",office_products
B008982LD4,3,the wireless signal did not reach as far as the uverse signal,1.0,"[""wireless signal""]",[0],electronics_p1
B093F7SP44,1,loved the characters and the plot,5.0,"[""characters"", ""plot""]","[2, 2]",kindle_store
B00IWNUD4U,5,when the battery is low,3.0,[],[],electronics_p1
B016JPTMIK,3,i have always enjoyed nora's trilogy sets and this [GENERIC_NOUN] is right in line,5.0,"[""nora's trilogy sets""]",[2],kindle_store
B088TJNL5K,3,the [GENERIC_NOUN] is made of soft ptu so its easy to handle and put ipad in and out when i need,5.0,[],[],electronics_p2
B004I45BLW,25770028161,the best feature of this program is the ability to import recipes from a wide variety of websites including the mega sites like epicurious and allrecipes and blogs,5.0,"[""feature""]",[2],software
B00NOZMNSU,4,each [GENERIC_NOUN] of her books offer an exciting funny steamy story that never gets boring is never the 34 same old same old 34 this was beautifully written the story characters flow with a natural grace that is geri foster's trademark,5.0,"[""books"", ""books"", ""books"", ""books"", ""books"", ""story"", ""story"", ""characters""]","[2, 2, 2, 2, 2, 2, 2, 2]",kindle_store
B00XHWBDYU,27,br br the dock portion itself includes 4 trays that you can interchange to get an exact fit for the model of ipod you own,4.0,[],[],electronics_p1
B09Y2JFK4Q,1,colorful love these labels,5.0,"[""labels""]","[""2""]",office_products
B078VP8D9C,3,she does so while showing the love heart endurance friendships and bravery of the characters while sticking to the facts and making history interesting for all to read,4.0,"[""characters"", ""history""]","[2, 2]",kindle_store
B008HVN9GG,11,two other pockets in the center accept business cards,5.0,[],[],office_products
B07BLKHQK6,1,solid feel and works with light touch,5.0,"[""feel"", ""touch""]","[2, 2]",electronics_p2
B0BN5NJNQQ,1,love color fits perfectly,4.0,"[""color""]",[2],electronics_p1
B0B69GHNHJ,1,crane is the stationery,5.0,[],[],office_products
B008C2MO0C,9,for instance you can t click on start to get to normal regular [GENERIC_NOUN] right at my finger tips as i can do on the windows 7,1.0,[],[],electronics_p1
B005S4YK22,103079365152,id recommend buy it again,5.0,[],[],software
B08GX13XW2,1,sturdy has many holders enjoy using it for my purse to have all my credit cards handy and business cards available when i need them,4.0,"[""holders"", ""purse"", ""purse""]","[""2"", ""2"", ""2""]",office_products
B0BCJKKZD4,7,great [GENERIC_NOUN],5.0,[],[],electronics_p2
B01L1AG1WS,1,but it will be nicer if each single layer can be wider to hold more,5.0,"[""layer"", ""layer"", ""layer""]","[""2"", ""2"", ""2""]",office_products
B00VXK8HMO,1,the inserts do not stay in place at all i,2.0,"[""inserts""]",[0],electronics_p2
B00B8IGZYS,94489362846,best spades game i have tried a number of spades apps and most of them are stupid,5.0,"[""spades game"", ""spades apps""]","[2, 0]",software
B00E257ZXY,1,fairly thorough description of the [GENERIC_NOUN] the sub genre has evolved over [GENERIC_NOUN],4.0,[],[],kindle_store
B08D356XB6,16,quality is lacking i love kensington trackballs and had high hopes for the fusion orbit,2.0,"[""quality""]",[0],electronics_p2
B08NC1LM49,3,if the perforated pages dont bother you then this will be worth every penny,3.0,"[""perforated pages""]","[""2""]",office_products
B009RPTFIC,1,maggie thom's captured lies is a suspenseful thrill of a ride and should be on your summer read list,4.0,"[""maggie thom's captured lies""]",[2],kindle_store
B00B0VYCL6,103079310002,im sure mommy and daddy were trying to teach her some responsibility by buying her her own restaurant but apparently this little test has failed miserably,2.0,"[""restaurant""]",[0],software
B07TFCW9PL,1,great for grandparents and family no assembly required,5.0,"[""grandparents"", ""family"", ""assembly""]","[""2"", ""2"", ""2""]",office_products
B004BDOJEK,12,the contrast of ordinary woman extraordinary circumstances has more meaning in the lily bard' series than any other of charlaine's works,5.0,[],[],kindle_store
B0C5MF2LCQ,2,they do the trick to charge your phone ipad but don t expect a fast or lightning charge,4.0,"[""charge""]",[1],electronics_p1
B07GVBGNB8,7,it is essentially a warm [GENERIC_NOUN] of pie and a cup of hot tea rolled up into a comforting story,4.0,[],[],kindle_store
B01CBV2K8U,831236,my main complaint is the fish tanks are too difficult to complete and rewards could be better,4.0,"[""fish tanks"", ""rewards""]","[0, 1]",software
B00JHOVWO8,1,four [GENERIC_NOUN] not easy to place phone in dock otherwise its a very decent [GENERIC_NOUN],4.0,"[""dock""]",[0],electronics_p2
B09ZLMFPPM,2,br br other features i likebr the rubberized housing on the plugs seems more durable than some of the hollowplastic ends i ve seen on other adaptersbr having a length of cord between the two ends places less strain on my laptops usb ports than an adapter with a formfactor more akin to an older thumbdrivebr since i merely need a serial port to plugin the nullmodem or serial cables that ship with various [GENERIC_NOUN] of hardware i appreciate that this has only a short cord rather than others that are needlessly long,5.0,"[""housing on the plugs"", ""length of cord"", ""short cord""]","[2, 2, 2]",electronics_p2
B0B4WNJT4G,3,the ink looks very nice on paper dries quickly but doesnt dry in your pens reservoir,5.0,"[""ink"", ""ink"", ""ink""]","[""2"", ""2"", ""0""]",office_products
B087D9VRGC,2,decent speaker i needed a new speaker because my jbl flip 4 would not hold a charge,4.0,"[""speaker""]",[1],electronics_p1
B00DUGK6LY,2,share the joy these cards are very pretty,5.0,"[""cards""]","[""2""]",office_products
B017QS4E8M,2,bad instructions needs to have better instructions,3.0,"[""instructions"", ""instructions""]","[""0"", ""2""]",office_products
B00OLCWPH4,3,photo resolution is excellent,4.0,"[""photo resolution""]",[2],electronics_p1
B008K6HN8I,25769879074,help assistant couldnt help me with this app,1.0,"[""assistant"", ""app""]","[0, 0]",software
B08NJBR65J,1,binding is solid too it has been living in my backpack and has held up fine,5.0,"[""binding"", ""binding""]","[""2"", ""2""]",office_products
B094VGTBM4,1,i have lowpile berber carpet and this mat allows my desk chair to roll freely,5.0,"[""mat""]","[""2""]",office_products
B00MV9EL6M,51539691637,loved this price,5.0,"[""price""]",[2],software
B0BZLBL1L9,1,a good 5port switch,5.0,"[""5port switch""]",[2],electronics_p2
B007JGBSCC,9,the surface feels more like glass and it s definitely a great improvement over the original shield,1.0,[],[],electronics_p1
B017250D16,371843,gracias good,5.0,[],[],software
B07WHNJ9H8,4,br there is [GENERIC_NOUN] i found odd that certain angles on the pen will make this sound and feel as if its scratching up the screen like tiny grains of sand,3.0,[],[],electronics_p1
B07FL4T5VJ,2,i got this [GENERIC_NOUN] to make sure my id badge would not accidentally get lost but,5.0,[],[],office_products
B0B8RSKT46,4,the colors already matched the colors on my other monitors,4.0,"[""colors""]",[2],electronics_p1
B000XBI3JQ,2,just ok display is easy to see functionality is good,3.0,"[""display"", ""functionality""]","[""2"", ""2""]",office_products
B00UTPQB8G,1,can not wait to read more from this talented author,5.0,"[""author""]",[2],kindle_store
B00006JQ06,7,the best pocket radio i have ever had so much has been written about this so i will be brief,5.0,"[""pocket radio""]",[2],electronics_p1
B00G8EK9T4,1,can not wait to read more in the series,5.0,[],[],kindle_store
B075X8471B,1,four [GENERIC_NOUN] really enjoy our fire stick,4.0,"[""fire stick""]",[2],electronics_p1
B071DSP6D6,2,i admire rose for telling her story and for being on the forefront of the me too movement,5.0,"[""rose""]",[2],kindle_store
B08GPJYPXD,3,the pace 2 also seems reasonably accurate with nice functionality and it synchs very easily with my iphone and strava,3.0,"[""accuracy"", ""functionality"", ""syncing with my iphone and strava""]","[2, 2, 2]",electronics_p2
B084M1Q36J,21,but with the help of family and friends its not too much to take on solving a murder right,5.0,[],[],kindle_store
B07P24XDPW,1,great lightweight laptop bed tray less than 4 lbs,5.0,[],[],office_products
B0196KA3T2,2,plenty of room below for keyboard or a paper tray,5.0,"[""room below""]",[2],electronics_p2
B00NR1EHP8,4,br i returned it immediately and bought the arris surfboard sbg6900ac which is much better,1.0,"[""arris surfboard""]",[2],electronics_p1
B009T3EYHO,225,browser is nice and fast,5.0,"[""browser"", ""browser""]","[2, 2]",electronics_p2
B071J3PFJJ,3,other than that it functioned just like i would expect any other [GENERIC_NOUN] to function meaning it was thin turned off the ipad when closed and protected it,5.0,[],[],electronics_p1
B0010OXEDU,4,br setup with the free tzo service required 2 phone calls to their tech support,3.0,[],[],electronics_p1
B008ABLJHE,1,print quality is very nice,5.0,"[""print quality""]","[""2""]",office_products
B0CDGCH3CR,1,i needed a heavy duty pliertype hand stapler and this [GENERIC_NOUN] is just perfect,5.0,"[""hand stapler""]","[""2""]",office_products
B0063IH60K,744600,and gotta love the price,5.0,"[""price""]",[2],software
B013DG2FNW,1,my niece loves it works well,5.0,"[""niece"", ""it""]","[""2"", ""2""]",office_products
B01MCV3VA4,5,after talking to the [DOMAIN_NOISE] and the manufacturer i decided to rerun it,3.0,[],[],electronics_p2
B06ZXXX7H3,14,the black tide rebellion is a bone chilling story about surviving in a lonely world,5.0,"[""black tide rebellion""]",[2],kindle_store
B07S4GWTLR,1,clown horror done right,5.0,[],[],kindle_store
B08RLW7918,3,[DOMAIN_NOISE] has incorrect [GENERIC_NOUN] information,1.0,"[""information""]",[0],electronics_p1
B01B6ZOMIS,3,excellent [GENERIC_NOUN],5.0,[],[],electronics_p2
B0BNPZKTVJ,1,the handles work nice this is a good mediumheavy weight shrink wrap,5.0,"[""handles"", ""shrink wrap""]","[""2"", ""2""]",office_products
B00N1XIY5Q,717017,large music choice not too many ads title says it all,4.0,"[""music choice""]",[1],software
B00KWVZ750,8590050562,good game really like the rug elements of this game,5.0,"[""game"", ""rug elements""]","[2, 2]",software
B00TE2QPMM,3,saving jay was wonderful and amusing and ended the series off in the best [GENERIC_NOUN],5.0,"[""saving jay"", ""saving jay""]","[2, 2]",kindle_store
B007F7N11Q,2,i have been searching for a good speaker mic for the baofeng radio,3.0,[],[],electronics_p2
B09GG9RK5C,2,the slightest touch of the tip to paper makes the pen refill bounce off the page,1.0,[],[],office_products
B00WX8JTRC,29,br br between mediabridge and monster i think the monster would be marginally better in picture quality and better in sound quality,5.0,[],[],electronics_p2
B0BD8PMCQJ,1,fits my need i did not like the fact that some of the instructions were not clear like assembling the bottom drawer,4.0,"[""instructions"", ""bottom drawer""]","[""0"", ""0""]",office_products
B07KJGSZ6S,1,when a young independent widow and mother of two is yentaized with a grumpy handyman by four golden girls the attraction is strong and his secrets are out of this world,3.0,[],[],kindle_store
B08J91XPGV,8,br br i have a directv dvr which is connected to my tv via hdmi,5.0,[],[],electronics_p1
B00TJ4XMEO,1,the story was good but a little slow developing for me,3.0,"[""story"", ""story""]","[2, 0]",kindle_store
B0B1GVN7YQ,20,this family is so easy to love because they love and champion each other,5.0,"[""family""]",[2],kindle_store
B00DB3I4PQ,85899452727,she likes to hear all the animal sounds,5.0,[],[],software
B01LZZWJRG,2,how could i not after reading a story about vincent a sexy baker and evey who likes to eat [GENERIC_NOUN] of his muffins everyday with a cup of coffee,5.0,[],[],kindle_store
B08TTH6L4X,1,i always enjoy the first in a new sword and sorcery series and this novel make me want to read more,4.0,"[""first"", ""novel""]","[2, 2]",kindle_store
B000GD5DS0,60129792428,this fix the bil and for a good price,4.0,[],[],software
B014JP5POC,1,the first [GENERIC_NOUN] i received arrived warped and did not fit my ipod touch 7th gen despite it saying it does ok,1.0,[],[],electronics_p2
B000GCFBUG,2,i enjoyed this novel because it was a great mix of interesting characters many of whom have competing interests,4.0,"[""novel"", ""mix"", ""characters""]","[2, 2, 2]",kindle_store
B09772FZTX,1,i then tested it by playing tetris effect a game that requires precise and fast tapping of buttons but the controller could not keep up,1.0,"[""controller""]",[0],electronics_p2
B0B1M6Q6XC,20,my ipad has remained pristine,5.0,[],[],electronics_p2
B00L0YLRUW,2,added to comcast wifi to extend range has good range,5.0,"[""range""]",[2],electronics_p1
B07CZ6DCZ7,6,i went back to using the headphone output from my edirol monitors because this headphone amp sounded terrible,1.0,"[""headphone amp""]",[0],electronics_p2
B00CAZ04MW,2,other than that pretty well built phone works well with voisip cloud pbx pretty easy to program and use,3.0,"[""phone"", ""phone"", ""phone""]","[""2"", ""2"", ""2""]",office_products
B0B3MX7LVG,3,if you snatch the tape off it definitely will pull paint off of your wall but permanently stuck to my wall where moving was impossible,2.0,[],[],office_products
B00NG7JVSQ,8590223247,if turbotax was so inclined im sure they could have found a [GENERIC_NOUN] to establish [GENERIC_NOUN] consistency without crippling their alleged 34deluxe34 [GENERIC_NOUN] and creating a 34bait and switch34 scenario for many of their customers,1.0,[],[],software
B006SBBNV0,1,great features included these phones do the job,5.0,[],[],office_products
B09QD52KWF,2,this book was such a fun read and pulled me out of my slump,4.0,"[""book"", ""book""]","[2, 2]",kindle_store
B00QPP7N4U,3,the glass itself seems well manufactured and thin but i can not seem to get it onto my ipad without bubbles,3.0,"[""glass"", ""glass"", ""glass""]","[2, 2, 0]",electronics_p2
B07Z9LCVCS,2,our router signal just did nt make it across our entire house,5.0,"[""router signal""]",[0],electronics_p2
B0BCTG71RQ,4,br i used a msi b360 mortar mb with an i5 8400 16gb crucial ddr4 2666 sabrent pcie nvme 500gb seagate 1tb 7200rpm msi rx570 gddr5 4gb open [DOMAIN_NOISE] thermaltake 500w ps,5.0,[],[],electronics_p1
B00BS3UFCQ,34359955601,guess the movie is very entertaining,5.0,[],[],software
B01N5YESHO,34360102296,the storyline was very good also in this game,5.0,"[""storyline""]",[2],software
B07YBNHRYX,1,favorite pens in office these are now the favorite pens in the office,4.0,[],[],office_products
B06VWS336R,85899405339,slight p2w but what mobile game isnt like that,5.0,[],[],software
B000T8THL6,3,i paid extra for the lightscribe ability only to be totally disappointed,1.0,"[""lightscribe ability""]",[0],electronics_p1
B09G2SFXSZ,2,no [GENERIC_NOUN] what power supply we plug it into even the anker usb neither cord works properly,3.0,"[""cord""]",[0],electronics_p1
B000A2K4NG,1,[DOMAIN_NOISE] sells the 100 print pack are 30,5.0,[],[],office_products
B002GEDEJM,1,amazing book but the requiremnts o b able o throw wa insane,5.0,"[""book"", ""requirements""]","[2, 0]",kindle_store
B09M53TZ7H,1,apache al 13 13 laminator hotcold for documents or photos so far it works great for what i have been using it for,5.0,"[""apache al 13 13 laminator""]","[""2""]",office_products
B07KQWX947,48,great sound,2.0,"[""sound""]",[2],electronics_p2
B0BK6WLS36,4,when we speak on cellphones our voice gets manic and highpitched,5.0,"[""voice""]",[0],electronics_p2
B07HC7M81W,1,i loved the relationship between noah and jjcant wait to read about rj,5.0,"[""relationship"", ""rj""]","[2, 2]",kindle_store
B01CL2LYMM,1,daughter loves it,5.0,"[""daughter""]","[""2""]",office_products
B07L9M1LKQ,11,and in the [GENERIC_NOUN] of recording a tape the record head is before the read head thus you could monitor the output from the tape deck as you recorded the on the tape,5.0,[],[],electronics_p1
B075PVNG2S,3,white this story is ashs my heart bled for embry to the [GENERIC_NOUN] of tears within the first 30 the tragedy of their love is just so real,5.0,"[""tragedy""]",[2],kindle_store
B001N84M2A,1,they informed me that the price i paid for my laptop would be forward to me,5.0,[],[],electronics_p1
B019R2QU4G,1,the finish on all is well above the norm and they are made well enough to be used for heavy use,5.0,"[""finish""]",[2],electronics_p1
B09YDHLYRL,1,great battery life the only [GENERIC_NOUN] is ofcourse having to disconnect from the speaker to allow another phone to connect sometimes that takes a minute but it works well,5.0,"[""battery life"", ""speaker""]","[2, 2]",electronics_p1
B00WV88Z7Y,77309609099,fire 10 doesnt work for this device,1.0,"[""fire 10""]",[0],software
B00DJFIMW6,397101,fun fun fun my grandson loves it,4.0,[],[],software
B0015AB6DO,4,rubber earbuds do nt come off easily a good [GENERIC_NOUN],5.0,"[""rubber earbuds""]",[2],electronics_p2
B00U2MF8WG,1,it was most humbling and emotional to retrace the steps of those fine patriots who literally fought for our freedom,4.0,[],[],kindle_store
B0C1CPTMG9,12,this computer is great for everyday use it has the perfect specs for just browsing the internet and watching videos at a good speed and loads up applications pretty quick,4.0,"[""computer"", ""specs"", ""speed"", ""applications""]","[2, 2, 2, 2]",electronics_p2
B086P836K4,2,teachers look elsewhere,1.0,[],[],office_products
B00N28818A,204305,always have the same movies,1.0,[],[],software
B08J7XM7KL,1,perfect size not too big,5.0,"[""size""]","[""1""]",office_products
B07MTQWQ7X,1,awesome system ever needed to take notes and then rearrange them but a regular notebook binder break and are too large,4.0,[],[],office_products
B0093I952O,6,vx520 uses smaller rolls than vx510 now with more wasted paper from above report [GENERIC_NOUN] causing an even higher cost of operation,3.0,"[""vx520"", ""vx510"", ""cost of operation""]","[""0"", ""0"", ""0""]",office_products
B0BPLTFGM6,12,the software failed several [GENERIC_NOUN] to configure the camera,1.0,"[""software""]",[0],electronics_p1
B083J85NTD,1,gps mount [GENERIC_NOUN] is [DOMAIN_NOISE] for my original mount that was broken after many [GENERIC_NOUN] of use,5.0,[],[],electronics_p1
B00O4RRHP6,1,doesn t not accept the window blinds ir,3.0,[],[],electronics_p1
B00ESEXFGU,103079330891,great job on devoloping,5.0,[],[],software
B00FKJK9S4,3,envy and intrigue pepper this story that made me ponder my own belief in what awaits in the hereafter,5.0,"[""story"", ""story""]","[2, 2]",kindle_store
B09KP35J9S,3,the e book had a number of grammatical errors and typos,4.0,"[""e book"", ""e book""]","[0, 0]",kindle_store
B0C8BLGMCF,1,and i also draw on my coworkers white boards so these make my designs super detailed,5.0,[],[],office_products
B07PGC2Z3S,3,the next story should be amazing since this book is a set up for the next book in the series,5.0,[],[],kindle_store
B0035X1EC2,2,recomendado uso diario y viajes al campo lo compr inicialmente como radio para emergencias pero termin usandolo todo el tiempo buena duraci n de las bater as que son ventaja al ser doble a aa,4.0,"[""duración de las baterías"", ""baterías""]","[2, 2]",electronics_p2
B07VVJ3LZM,2,i love the lightweight and the durability of the tripod,5.0,"[""lightweight"", ""durability""]","[2, 2]",electronics_p2
B006COU224,1,clock feature instant weather instant 9 and 19 at push button are all really nice,5.0,"[""clock feature"", ""instant weather""]","[2, 2]",electronics_p2
B003MOKUIS,1,panasonic range extender really works this extender was easy to set up and delivers a strong signal with excellent tone to the far end of a large steelframed house,5.0,"[""range extender"", ""extender"", ""extender"", ""extender""]","[""2"", ""2"", ""2"", ""2""]",office_products
B00WSLYQ7C,49,the 280s exert more pressure around your head,5.0,"[""280s""]",[0],electronics_p2
B0BZ7768GW,2,the android hifi sound really enhances the overall listening [GENERIC_NOUN],5.0,"[""android hifi sound""]",[2],electronics_p1
B00HX788PW,68719479476,four [GENERIC_NOUN] toddler loved it until the next game,4.0,[],[],software
B00Z7RPY2U,21,the made it beautiful i do nt like the [GENERIC_NOUN] the microphone head jack extension was made,5.0,"[""microphone head jack extension""]",[0],electronics_p2
B001SQS7KU,1,leaky love the flavor however the cream leaked out all over the [DOMAIN_NOISE],3.0,"[""flavor"", ""cream""]","[""2"", ""0""]",office_products
B07456BG8N,74,i was able to connect my ring device awesome device,5.0,"[""ring device"", ""device""]","[2, 2]",electronics_p2
B013HOK0LY,8590180943,the only complaint i have is that some of the pictures are used in more than [GENERIC_NOUN] game and not always for the same word,4.0,"[""pictures""]",[0],software
B0066TUXU6,17180125857,its great being able to catch up on missed episodes and their selection of available movies augments other online services quite nicely,5.0,"[""selection of available movies""]",[2],software
B08JV8NB1Z,6,however [GENERIC_NOUN] key feature is lacking,4.0,"[""key feature""]",[0],electronics_p2
B0082ES3L4,2,i ve played with external evf s on a few cameras and this [GENERIC_NOUN] is the closest to real [GENERIC_NOUN] i ve seen,5.0,"[""external evf""]",[2],electronics_p1
B08GNRGB67,4,i can t take it anymore,1.0,[],[],electronics_p1
B08K8W68BX,2,the value and quality are amazing,5.0,"[""value"", ""quality""]","[2, 2]",electronics_p2
B0BYFHJWHC,1,es m s lindo la decisi n de los colores,5.0,"[""colores""]",[2],electronics_p2
B01MT3H3XS,1,the markers eraser and magnets that came with it are also great quality,5.0,"[""markers"", ""eraser"", ""magnets""]","[""2"", ""2"", ""2""]",office_products
B00C57PN6W,2,very nice built nice sound feels somewhat premium and very carryable which is great,5.0,"[""build"", ""sound"", ""feel"", ""portability""]","[2, 2, 2, 2]",electronics_p2
B07YVV61MT,2,my favorite feature super easy call blocking,5.0,"[""feature""]","[""2""]",office_products
B086G89ZD3,4,what stands out to me is the [GENERIC_NOUN] this story all though set in the future occupied earth reflects all that is going on in world today with viruses and racial inequality,5.0,"[""story""]",[2],kindle_store
B00UT3O46E,2,but this mount makes the task a breeze,5.0,"[""mount""]",[2],electronics_p1
B08P9B4PCQ,2,the [DOMAIN_NOISE] was only 12 what i paid,1.0,[],[],office_products
B07CSG79QX,2,no adhesive on envelopes the envelopes had 0 glue on them so had to tape them shut,4.0,"[""envelopes"", ""envelopes""]","[""0"", ""0""]",office_products
B003C1AO2I,12,i also must add i shopped around for a long [GENERIC_NOUN] trying all the sound bars available at the local frys and best buy i was only looking in the 150400 dollar range,5.0,[],[],electronics_p2
B07KD63NJC,4,works great having 64gb of storage is great,5.0,"[""storage""]",[2],electronics_p1
B0C4KLM3K5,1,magnetic sturdy has hooks magnets etc,5.0,[],[],office_products
B016XEGI16,2,[GENERIC_NOUN] of my 34cards34 is paper so the top of the paper card gets very bent even with the slight bow cut opening in the top of the sleeve to make grabbing the card easier,2.0,"[""paper card""]","[""0""]",office_products
B01N4IOQP6,8,br br save your hard earned money and purchase a different system,3.0,[],[],electronics_p1
B009UX2YAC,659400,grandson has fun playing,3.0,[],[],software
B00IAQ3RJM,25769959673,great game what a fun game,5.0,"[""game"", ""game""]","[2, 2]",software
B00CBFYPQC,1,loved all the characters in the book,5.0,"[""characters"", ""book""]","[2, 2]",kindle_store
B07CGNSWMC,34359947157,quality easy to set up great pictures,5.0,"[""quality"", ""pictures""]","[2, 2]",software
B09MF25SCF,2,br for the price is fair good sound quality fit well and also good battery,5.0,"[""price"", ""sound quality"", ""battery""]","[1, 2, 2]",electronics_p1
