parent_asin,sentence_id,sentence_text,rating,aspects,sentiments,category_name
B06XK2N92C,3,faith and pix are good mothers dealing with typical lives you can relate too,5.0,"[""faith"", ""pix""]","[2, 2]",kindle_store
B071LPXMP1,60129674435,great to see all my favorites including cold war armageddon world war 2 in hd vietnam in hd,5.0,[],[],software
B08KRDL7G7,2,more compartments to carry [GENERIC_NOUN] other than your laptop and accessories,5.0,"[""compartments""]",[2],electronics_p2
B00EDWAAD8,1,works great with arthritis writes smooth and they are easy for arthritic hands to hold,5.0,"[""arthritis"", ""writing"", ""hands""]","[""2"", ""2"", ""2""]",office_products
B0B358XRTK,2,some big changes are coming for the family,4.0,[],[],kindle_store
B00260PV1A,1,four [GENERIC_NOUN] hand grabbing a [GENERIC_NOUN] of plastic when used for a long [GENERIC_NOUN] yiyeoseo seem to hurt the hand,4.0,"[""hand""]","[""0""]",office_products
B00LV4D70O,8590256641,save cash,4.0,[],[],software
B00OPYZORG,68719483908,daddydaddyand more daddy hit download and prepare to play a amazing app,5.0,[],[],software
B00N3O6B1M,3,the photo on the card is crisp and adorable,5.0,"[""photo"", ""photo""]","[""2"", ""2""]",office_products
B0B42NYTZZ,7,great design easy installation and fantastic software this camera is fantastic,5.0,"[""design"", ""installation"", ""software"", ""camera""]","[2, 2, 2, 2]",electronics_p2
B00I52NNSG,94489426752,repeated why oh why do all theses games have so many [GENERIC_NOUN],3.0,[],[],software
B0BXNQ1PCN,1,awesome travel companion,5.0,"[""travel companion""]",[2],electronics_p2
B006HY2OSY,17180139841,[GENERIC_NOUN] [GENERIC_NOUN] will not load as it should,1.0,"[""it""]",[0],software
B001QY0YRS,1,it says store upright and i did so im not sure what happened,1.0,[],[],office_products
B01248YO8E,17180338373,great stress reliever beautiful images and a large selection of colorstextures,5.0,"[""stress reliever"", ""images"", ""selection"", ""colorstextures""]","[2, 2, 2, 2]",software
B0BJXVHHQ1,10,i chose this i i need a backlighted keyboard,1.0,[],[],electronics_p2
B07KWD2T92,1,your ability to weave these words into a story of not only love but heartbreak,5.0,"[""ability""]",[2],kindle_store
B01DDY5IMY,1,the story started out innocently enough,5.0,[],[],kindle_store
B0BBQ8VBHD,1,fans work well actually better than more expensive fans i ve bought previously,5.0,"[""fans"", ""fans""]","[2, 2]",electronics_p2
B00007L6C2,3,no losing the ends of your tape and getting it stuck to itself no need for a dispenser or sharp blades just tear it with your hands easy peasy,5.0,[],[],office_products
B08431ZSY5,1,each book can be read as a stand alone however this is such an amazing series that i recommend starting on book 1 and reading all of them,5.0,"[""book"", ""series""]","[2, 2]",kindle_store
B0BPX5VQ2M,14,br br i do not recommend [GENERIC_NOUN] buy from them unless they find a [GENERIC_NOUN] to improve their customer service,1.0,"[""customer service""]",[0],electronics_p2
B09H4X74HK,3,its march 2022 and i m already on the third charger,3.0,"[""charger""]",[0],electronics_p2
B076DD5JNS,2,not a gopro but good enough got this for an 11 [GENERIC_NOUN] old,5.0,[],[],electronics_p1
B0076GEMGO,5,in the meantime pairing the two panasonic [GENERIC_NOUN] appears to have been a good decision,4.0,[],[],electronics_p1
B0995JS7K9,44,great all around camera great camera for security and keeping an eye on my pets,5.0,"[""camera"", ""camera""]","[2, 2]",electronics_p2
B0863SBSZR,3,will allow you that [GENERIC_NOUN] dream so vital in staying competitive,5.0,[],[],electronics_p1
B003N9PJDI,16,the only draw back when i read some other [GENERIC_NOUN] was that you could only control the volume from the speaker itself,5.0,"[""volume""]",[0],electronics_p2
B07DGSPTQB,68719580462,easy [GENERIC_NOUN] to [GENERIC_NOUN] all apps nice [GENERIC_NOUN] to present apps more clearly and remove unused,4.0,"[""apps""]",[2],software
B0BHHL8LQG,3,my young reader wanted to know more about owl pellets and paleontologists after we read the book,5.0,"[""owl pellets"", ""paleontologists""]","[2, 2]",kindle_store
B008IUB17K,7,no worries kade decides to pursue tom anyway and the chase and eventual capture is a fun ride,3.0,"[""story""]",[2],kindle_store
B00A11AN6O,140414,several [GENERIC_NOUN] later hard drive crashed and we attempted to recover our photos from the cloud drive,1.0,[],[],software
B0786WK3YH,5,giorgia repeatedly expresses regrets about the current decadence of her hometown celebrated for its artistic and cultural life with the oldest university in the world at its epicenter it has meanwhile undergone a gentrification process which has dangerously affected its customary welcoming soul evident for instance also in the rich gastronomic tradition,5.0,"[""hometown"", ""hometown"", ""hometown"", ""hometown"", ""soul"", ""tradition""]","[0, 2, 0, 0, 0, 2]",kindle_store
B0BQGFD32R,1,but some of the small [GENERIC_NOUN] were folded over and creased funny,3.0,[],[],office_products
B097WSGQH1,5,installation by a mechanic took 3 hours so don t do it if you re a rookie,4.0,"[""installation""]",[0],electronics_p1
B007UZCIBW,1,so these [GENERIC_NOUN] came super early,5.0,[],[],electronics_p1
B016D9PJX4,4,this tablet is perfect for [GENERIC_NOUN] moviesgamessurfing net,5.0,"[""tablet""]",[2],electronics_p2
B003X26LXW,1,between discovering a missing sim card and replacing and then working with all the technical [GENERIC_NOUN] this camera was just 34 okay 34,3.0,[],[],electronics_p1
B07X218VMR,4,war is bad love is good,5.0,[],[],kindle_store
B01N26SWTF,60129838328,great game can become addictive,5.0,"[""game"", ""game""]","[2, 2]",software
B00HQ2R38C,7,i m now able to switch audio sources by remote instead of having to get up and unplugplug in the appropriate cable,5.0,"[""remote""]",[2],electronics_p2
B093TSR66S,1,good quality been using it fot a [GENERIC_NOUN] quality video quality is goodbr i like the always monitoring feature where it starts recording if it detects shakes or contact but wish they would include the wiring kit to make this featurw work and not buy it separately,5.0,"[""video quality"", ""always monitoring feature"", ""wiring kit"", ""wiring kit""]","[2, 2, 0, 0]",electronics_p2
B0B24D8NSR,1,the fact that they come with different ear bud sized cushions make them a good fit for [GENERIC_NOUN],5.0,"[""ear bud sized cushions""]",[2],electronics_p1
B08GST9TGC,1,so here is another book about machine learning with python,4.0,[],[],kindle_store
B07SY7MYD9,2,the pad has a firm yet comfortable makeup,5.0,"[""pad""]","[""2""]",office_products
B0BLQ7R2JB,5,the poly spiral cover and the smaller a5 [GENERIC_NOUN] of this book are great,1.0,"[""poly spiral cover"", ""smaller a5""]","[""2"", ""2""]",office_products
B00WX2P5YE,2,both the black dog macsen and his daughter therriey deserve the love that they have regain and found,5.0,[],[],kindle_store
B00009Q989,18,itrip is destined to become 4stars with a little tweaking and concise compatibility descriptions from the manufacturer in [GENERIC_NOUN] description,3.0,[],[],electronics_p2
B07WP8WC3V,1,best [GENERIC_NOUN] i have used the best ever [GENERIC_NOUN] for a pi ever invented,5.0,[],[],electronics_p1
B005ZXWMUS,252341,after awhile the netflix app merged my accounts and deleted some of my shows off my wish list,3.0,"[""netflix app"", ""netflix app""]","[1, 0]",software
B083TH1B45,1,sturdy purchased over two [GENERIC_NOUN] ago and can honestly say it s [GENERIC_NOUN] of my better investments,5.0,[],[],electronics_p1
B07RRB9PD2,2,out performs other amplifiers 3xs the size which i used in the past,5.0,[],[],electronics_p2
B00HH1G3ZG,1,while some of the recipes looked interesting i just do not like a cookbook with out a single picture of the recipe,1.0,"[""recipes"", ""cookbook""]","[2, 0]",kindle_store
B00752VL8G,3,br br i shed a singly solitary tear like that indian on the [GENERIC_NOUN] of the highway in that 34dont litter34 awareness campaign from the 70s when panasonic announced they were exiting the plasma game,5.0,[],[],electronics_p2
B0786XGM8M,5,two [GENERIC_NOUN] audio is slow,3.0,"[""audio""]",[0],electronics_p2
B07CML419K,3,the double blades can carry air a little farther than normal and its relatively compact size means you can place it nearly anywhere,4.0,"[""double blades"", ""size""]","[2, 2]",electronics_p2
B0170RBJ9Q,4,br br as far as noise cancelling i can still hear [GENERIC_NOUN] going on outside of the music i m playing so i would say they do not cancel any outside noise,2.0,"[""noise cancelling"", ""outside noise""]","[0, 0]",electronics_p2
B00L827P98,42949963172,great entertainment for my elderly father my elderly father loves this wwe entertainment great [GENERIC_NOUN] spent for the price,5.0,"[""entertainment"", ""father"", ""entertainment"", ""price""]","[2, 2, 2, 2]",software
B092JRYP5J,2,i absolutely love these headphones,5.0,"[""headphones""]",[2],electronics_p2
B07BPCMSL3,103079301692,doesnt save progress doesnt transfer to child profile now its giving new a weird email for for errors or [GENERIC_NOUN],1.0,[],[],software
B004U2XO7A,3,now that i have a portable amfm radio i find this practice archaic,4.0,[],[],electronics_p2
B000W3X480,2,br as other reviewers mentioned the installation is easy,1.0,"[""installation""]",[2],electronics_p1
B001E7788K,17180276948,the customer service supervisor told me that the name antivirus implied it protected against viruses not that it actually destroyed viruses so that i was wrong to think that it would kill viruses already on my computer,1.0,"[""customer service supervisor"", ""name antivirus"", ""name antivirus"", ""name antivirus"", ""i"", ""it""]","[1, 1, 1, 1, 0, 1]",software
B01HAU2BM2,1,three [GENERIC_NOUN] they work but just kinda stick out a [GENERIC_NOUN],3.0,[],[],electronics_p1
B0BNNRQK1J,2,br br pros br quality materials and craftsmanship br high gauge cable br will last a long long [GENERIC_NOUN] br better quality that standard cables br quality connectors br much cheaper cost than store bought br get all your cables from these guys you wont be disappointed,5.0,"[""materials"", ""craftsmanship"", ""cable"", ""cable"", ""cables"", ""connectors"", ""cost""]","[2, 2, 2, 2, 2, 2, 2]",electronics_p1
B079SMGC7S,2,it took a while to read all of the background needed to understand what was happening but it was well worth the [GENERIC_NOUN],5.0,[],[],kindle_store
B002STGF6O,4,they re just as comfortable as the original pads,5.0,[],[],electronics_p2
B073Q9YKFD,1,the book moved at a good pace,5.0,"[""book""]",[2],kindle_store
B092MNBH1K,1,lord what did choyse done got [GENERIC_NOUN] involved inoh it is about to be some smoke in houstonits definitely about to go down,5.0,[],[],kindle_store
B005FCFUY4,1,and the [DOMAIN_NOISE] was fairly quick so i guess it was okay,4.0,[],[],electronics_p1
B071D3D2ZX,9,kales the suicide in the penthouse,1.0,[],[],kindle_store
B009V2UHIS,77309482899,scroll down to see what has the most points,5.0,[],[],software
B07ZYLZR2G,1,the angled plug that inserts into the phone lights up making it easy to find and use,5.0,"[""angled plug""]",[2],electronics_p1
B07QR2LSL3,2,i am thinking of buying the secondary market clip for the 400 series pens but the negative [GENERIC_NOUN] are daunting,2.0,"[""secondary market clip""]","[""0""]",office_products
B0B1VWCFXZ,4,better than any of my fitbits and for the extra money there is so many awesome bonuses,5.0,"[""bonuses""]",[2],electronics_p2
B0BC8C2KF2,12,the lack of a strap for hanging the backpack from the handle of toy suitcase is a total bummer but the backpack excels in every other [GENERIC_NOUN],5.0,"[""strap"", ""backpack""]","[0, 2]",electronics_p2
B07JF3CDVZ,111669197962,best app keeps my fire stick working great,5.0,"[""app"", ""fire stick""]","[2, 2]",software
B06Y4WCYCW,1,this lens worked like a charm for all 1400 great pictures,5.0,"[""lens""]",[2],electronics_p2
B002KGFOH6,2,i am not sure why a more appropriate design has not been available on any shredders that would allow minimal cleaning maintenance when removing shredded paper,4.0,[],[],office_products
B07H47Q8BC,42949806554,no errors or [GENERIC_NOUN] program installed updated then imported as much of my previous tax info as needed to lessen the info that i needed to input,5.0,[],[],software
B09R7S8HKF,1,i am happy because the color is a matte gold,5.0,"[""color""]","[""2""]",office_products
B06XQN9VHX,1,great radio 4 tradesman i bought this for professional use builder remodeler carpenter [GENERIC_NOUN] person to replace my dewalt 20 volt radio charger,5.0,"[""radio""]",[2],electronics_p2
B00PXZT1RA,440411,hint button never works always still charging including hidden [GENERIC_NOUN] scenes,3.0,"[""hint button"", ""hint button"", ""hidden scenes""]","[0, 0, 0]",software
B00YHZVOCW,17180232601,tried out starz since there was a 3month special,3.0,[],[],software
B08XNCHTCY,2,i came to write this [GENERIC_NOUN] because these earbuds paused or muted the youtube video i was watching 7 [GENERIC_NOUN] in the last 20 minutes just turning my head without me touching them with my hands,2.0,"[""earbuds"", ""earbuds""]","[0, 0]",electronics_p1
B08B5TXFXJ,1,enjoyable hi the [GENERIC_NOUN] received as described exactly,5.0,[],[],office_products
B00K23BZTA,4,the instructions do tell you what goes where and i never had to second guess or move [GENERIC_NOUN] around after the first boot,5.0,[],[],electronics_p1
B0BYYT78D9,2,colors dont print across entire page so i replaced my toner with these and i cannot get them to print across the entire page now,1.0,"[""colors"", ""toner""]","[""0"", ""0""]",office_products
B088WRB1H3,1,not anti glare the only [GENERIC_NOUN] anti glare about this [GENERIC_NOUN] is the sticker that had the word anti glare on the [DOMAIN_NOISE],1.0,"[""anti glare""]",[0],electronics_p1
B09CLTM5YT,2,poor binding coil binding is not very good on these,4.0,"[""binding"", ""coil binding""]","[""0"", ""0""]",office_products
B07SW6SMM3,2,students live to have their turn sitting on it to work,4.0,[],[],office_products
B004KPM14Y,3,[GENERIC_NOUN] other note what works in a lyric does not a narrative make,2.0,[],[],kindle_store
B07R5L1X6T,4,the first kiss comes well into the story when darach and tessa have [GENERIC_NOUN] to get aquainted,5.0,[],[],kindle_store
B00F167T2A,1,the best [GENERIC_NOUN] is that it came several [GENERIC_NOUN] before the official [DOMAIN_NOISE] [GENERIC_NOUN],5.0,[],[],electronics_p1
B08JKQ59CR,1,book by this author but will not be my last,5.0,"[""book""]",[2],kindle_store
B082MXJVH3,17,also do nt know if i just have a big head but the headphones are press very tight on my head and become uncomfortable after a while of use,4.0,"[""headphones"", ""headphones""]","[0, 0]",electronics_p2
B00DDXJRJG,94489381883,the eq button at the bottom of the window will open the equalizer section,5.0,[],[],software
B07YCFHMXQ,2,br battery life is great at least 10 or more hours of battery life,5.0,"[""battery life""]",[2],electronics_p1
B0BHF1HN6C,1,touchscreen need a slightly harder press than other manufacturers camera is [GENERIC_NOUN] of dark,4.0,"[""touchscreen"", ""camera""]","[0, 0]",electronics_p1
B07CRF3PYW,24,not compatible with winbook tw700 not compatible with winbook tw700,1.0,"[""compatibility""]",[0],electronics_p2
B01MTF2Z37,8,battery seems to be always low dead,1.0,"[""battery""]",[0],electronics_p2
B000V2TTNG,1,printhead failed after only 6 [GENERIC_NOUN] of medium use okay so maybe these [GENERIC_NOUN] arent designed to last that long but think of the waste,3.0,"[""printhead"", ""printhead"", ""waste""]","[""0"", ""1"", ""0""]",office_products
B088M9NCD2,8,this cable met all of those needs at a fantastic price,5.0,"[""cable"", ""price""]","[2, 2]",electronics_p2
B005K17RU0,8590085814,we travel quite a [GENERIC_NOUN] for his job and it is easy to add and remove location and we always know what the weather is at home,5.0,[],[],software
B0026IJA5A,1,but this was strictly a chance i would have to take with no guarantee that the [DOMAIN_NOISE] [GENERIC_NOUN] would correct the [GENERIC_NOUN],5.0,[],[],office_products
B077SYS1XY,4,since [GENERIC_NOUN] to say so far 1min later favorite reviwer 1hold sec ken or ryan,5.0,[],[],kindle_store
B007FIJ9EI,34360032856,3 no [GENERIC_NOUN] to my knowledge to watch the condensed [GENERIC_NOUN] of a game through the app,4.0,[],[],software
B07FFTVXHX,1,spotty service spotty signal unless phone and headphones are right next to each other,1.0,"[""service"", ""signal""]","[0, 0]",electronics_p1
B07V7Z2Y4W,42949760433,subscription is now cancelled do not renew or charge my account on wednesday 513,1.0,[],[],software
B08B8DKYPS,54,i found that it works as a very competent video projector for movies,5.0,"[""video projector""]",[2],electronics_p2
B01HDPFDQU,6,the police they encounter at the beginning do [GENERIC_NOUN],3.0,[],[],kindle_store
B06Y2F35WD,2,the quality of the seams is worth the little extra,5.0,"[""quality""]","[""2""]",office_products
B09BKPYNXD,2,the best stapler out there this is the best stapler on the market,5.0,"[""stapler"", ""stapler""]","[""2"", ""2""]",office_products
B00D948SS0,51539794725,like how it each puzzle is a different theme,5.0,"[""puzzle""]",[2],software
B00G1741NS,2,azalea exhibits the courage and the faith to pick up the [GENERIC_NOUN] of her life and start over all by herself,5.0,[],[],kindle_store
B00BFNCFXG,103079300001,a must have for people looking for an affordable pc compatible stop motion software,5.0,"[""stop motion software""]",[2],software
B0C3QYDB44,5,i keep an extra cord in my suv and also in my backpack,5.0,[],[],electronics_p2
B0064CL1T2,1,the relationship between two people and what secrets do to them and those around them is powerful,5.0,[],[],kindle_store
B002NL3PU6,4,i don t think i made a mistake buying it,3.0,[],[],electronics_p1
B083Y4S579,28,the buttons to set an alarm are not intuitive,3.0,"[""buttons to set an alarm""]",[0],electronics_p2
B089DQDPBG,2,this story is filled with imagination and mystery that will intrigue young and old,5.0,"[""story"", ""story""]","[2, 2]",kindle_store
B0BW89S5B6,3,a small little [GENERIC_NOUN] that i enjoyed was the dust cover in the charging port of the airpods this made me happy just because of how nice it was,5.0,"[""dust cover"", ""dust cover""]","[2, 2]",electronics_p2
B09PQQ4LZB,1,don t know why i didn t get them sooner,5.0,[],[],electronics_p1
B000VLZCEW,60129573451,the restore works even if the target drive is smaller than the original,5.0,[],[],software
B08B63NM5J,1,great calendar with lots of writing space i bought this calendar for my elder parents who use it to keep track of appts such,5.0,"[""calendar"", ""calendar""]","[""2"", ""2""]",office_products
B0BQBQDNSJ,2,the additional tiltrock made my chair much more comfortable,5.0,"[""tiltrock""]","[""2""]",office_products
B007S16X4Q,94489322835,each game is a 2 minute interval,5.0,[],[],software
B078HNWFVD,2,the coloring pencils she had was used for school and i thought she needed this for home,5.0,[],[],office_products
B01LXZLEMN,25769914447,as described good,5.0,[],[],software
B01LWUQR8Y,4,br small machine light weight easy to use with multi functions,5.0,"[""machine"", ""use""]","[2, 2]",electronics_p2
B00YB2HK42,1,lost [GENERIC_NOUN] provides a new and interesting perspective of the [GENERIC_NOUN] wars universe,4.0,"[""lost""]",[2],kindle_store
B07DLX7Q7W,51539639132,i just started using it all the [GENERIC_NOUN] for streaming and channels work 100 percent better,5.0,"[""it""]",[2],software
528959999,1,location names are easy to read,4.0,"[""location names""]","[""2""]",office_products
B00LV4D70O,8590254388,other than that its great just fix the graphics [GENERIC_NOUN],3.0,"[""graphics""]",[1],software
B093HMYQDP,8,this means as [GENERIC_NOUN] who uses the pen i can not remap the buttons or redefine the stylus pressure curve,3.0,"[""buttons"", ""stylus pressure curve""]","[0, 0]",electronics_p2
B0C5RK1W3Y,4,it would have been really nice if i could have selected which direction the cord came out of the plug,4.0,[],[],electronics_p1
B0BZQFNNGL,5,heph and perseus were so good together and the group scenes were spicy as hellllo,4.0,"[""heph and perseus"", ""group scenes""]","[2, 2]",kindle_store
B00HKKMSNA,8590038908,tricky could never get it to run more than a few moments,2.0,"[""it"", ""it""]","[0, 0]",software
B00FQGP2F6,68719694574,my musthave tool for transcribing practicing i cant transcribe or practice without it,5.0,"[""tool"", ""tool""]","[2, 0]",software
B09VHX7888,1,a copy of the scanned documents do not look good with a dark black line border around all four edges of the pages,3.0,"[""copy of the scanned documents"", ""dark black line border""]","[""0"", ""1""]",office_products
B07HD2W8XL,10,so i will seek to have the warranty kick in if seagate honors their commitment to what they sell but in these [GENERIC_NOUN] it appear to me they feel insensible to their low quality [GENERIC_NOUN] especially those manufactured in china,1.0,"[""quality""]",[0],electronics_p2
B00GNR9YQK,2,do not waste your money on these horrible subwoofers,1.0,"[""subwoofers""]",[0],electronics_p2
B00T9ML4U0,1,no dial tone buttons didnt work no ringer,1.0,"[""dial tone"", ""buttons"", ""ringer""]","[""0"", ""0"", ""0""]",office_products
B00N9YQ88C,51539626656,technical difficulties the game was fine but then as i was playing the game all of a sudden it went back to the home screen,3.0,"[""game"", ""game""]","[2, 0]",software
B00YHANLU0,2,for careful iphone users excellent gorgeous [GENERIC_NOUN],5.0,[],[],electronics_p1
B07R7KZCNM,8,why ca nt the spend the extra 10 cents for application tabs,1.0,[],[],electronics_p2
B0813X9G8T,3,not difference is temps for me so maybe better suited for [GENERIC_NOUN] fans,4.0,[],[],electronics_p1
B007GF80FO,34359753110,highly recommend this app,5.0,"[""app""]",[2],software
B07H65KP63,1,echo love the echo and the kids do to always asking her to play jokes,5.0,"[""echo""]",[2],electronics_p1
B01HKWAJ6K,1,love the tilt stand and the multiple mounting capabilities,5.0,"[""tilt stand"", ""multiple mounting capabilities""]","[2, 2]",electronics_p2
B0BK4DM5Z7,1,c [GENERIC_NOUN] cables cables very compliant easy to manage in car and at my desk,5.0,"[""cables"", ""cables""]","[2, 2]",electronics_p1
B00PB5AO4G,8590005239,needs an update hasnt been updated since march while the ios [GENERIC_NOUN] is updated regularly,2.0,"[""ios"", ""update"", ""update""]","[2, 0, 0]",software
B009ZZDNT6,34359836293,gradual increase in volume is nice feature,4.0,"[""volume""]",[2],software
B00OYTU62K,77309547932,fun to play good pay outs,5.0,"[""game"", ""payouts""]","[2, 2]",software
B000A0S6B0,8590056974,the search [DOMAIN_NOISE] is persistent no need to click on the toolbars search button every [GENERIC_NOUN] you want to find [GENERIC_NOUN] in this vast storehouse,5.0,[],[],software
B003E7ES4A,1,i purchased an xm xpmp3hi and paid the fee to xm to switch my service and wow and i glad i did because this little jewel can do so much more than the skydock,5.0,"[""xm ""]",[2],electronics_p1
B01AEAIBKQ,8,[GENERIC_NOUN] whose leads spin with pressure as you write to keep flat spots from developing on the lead,5.0,[],[],office_products
B07Y62MM2J,103079368694,instead turbotax sharted asking me my data to decide what [DOMAIN_NOISE] i needed,3.0,[],[],software
B01FWIP6NK,6,br it comes with an adaptor ring to attach to larger or smaller lens bases,4.0,[],[],electronics_p2
B08D82T51Q,2,easy read and loved all of the character in all of books,4.0,"[""read"", ""character""]","[2, 2]",kindle_store
B0BZTFG859,1,[GENERIC_NOUN] other [GENERIC_NOUN] of advise keep tracks and wheels clean,5.0,[],[],electronics_p1
B00701L5XS,17180014816,an informative visually instructive reference on knots knots are visually appealing with enough,4.0,"[""knots"", ""knots"", ""knots""]","[2, 2, 2]",software
B00ICFZ3SO,42949786620,good free entertainment good classic slot play with enough wins to keep you playing for free,5.0,"[""entertainment"", ""slot play"", ""wins""]","[2, 2, 2]",software
B00NH84T3G,2,a [GENERIC_NOUN] of fluff not a [GENERIC_NOUN] of this and that just you know this is how it is this is what you need to do,5.0,[],[],kindle_store
B0018IA6V6,1,five [GENERIC_NOUN] good buy,5.0,[],[],office_products
B08VV4PHQG,1,television [GENERIC_NOUN] audio was not superb,5.0,"[""audio""]",[0],electronics_p2
B0BGNG1294,5,br br when we received the cables hubby asked about which [GENERIC_NOUN] they were i checked the [DOMAIN_NOISE] there was no label saying which [GENERIC_NOUN] it was but the [DOMAIN_NOISE] did indicate that the cables were made in february of 2019,5.0,[],[],electronics_p1
B0055SS2UM,85899537913,tells the numbers how much its worth and the date,5.0,[],[],software
B00ANAE6PM,4,in some cases the magnetic force pulls others along in at least [GENERIC_NOUN] instance however it repels,5.0,[],[],kindle_store
B01M15WH9C,3,this purchase would either be for 1 [GENERIC_NOUN] 100 5 [GENERIC_NOUN] 200 or 10 [GENERIC_NOUN] 300,1.0,[],[],electronics_p1
B00B5L5JRM,17180316614,zoom love the feature what i dont like is sometime its glitchy,5.0,"[""feature"", ""feature""]","[2, 0]",software
B08LF2PXMW,1,easy to setup i had two 16 channel dvr from different companies on different system,5.0,"[""setup""]",[2],electronics_p2
B09QPMCP2K,3,this calendar provides plenty of room to write all my appointments,5.0,"[""calendar""]","[""2""]",office_products
B004SIIBGU,17179995406,fix it already geez come on guys get with it everybody uses ebay,1.0,[],[],software
B000LB7G00,10,the key was when i realized that you have to stop thinking about how to use the controller and instead just try to steer around your view,4.0,[],[],electronics_p2
B01IOO4SGK,15,also the 144hz refresh rate with gysnc is amazing as well,5.0,"[""144hz refresh rate with gysnc""]",[2],electronics_p2
